root@lamp-ubuntu-s-1vcpu-1gb-tor1-01:~# tcpdump -r 0001.pcap
reading from file 0001.pcap, link-type EN10MB (Ethernet)
21:27:41.736320 IP 143.110.223.72.ssh > cpe9050ca275d83-cm9050ca275d80.cpe.net.cable.rogers.com.64819: Flags [P.], seq 935851107:935851151, ack 3305452887, win 501, length 44
21:27:41.736565 IP 143.110.223.72.ssh > cpe9050ca275d83-cm9050ca275d80.cpe.net.cable.rogers.com.64819: Flags [P.], seq 44:152, ack 1, win 501, length 108
21:27:41.736722 IP 143.110.223.72.ssh > cpe9050ca275d83-cm9050ca275d80.cpe.net.cable.rogers.com.64819: Flags [P.], seq 152:188, ack 1, win 501, length 36
21:27:41.746585 IP cpe9050ca275d83-cm9050ca275d80.cpe.net.cable.rogers.com.64819 > 143.110.223.72.ssh: Flags [.], ack 188, win 3085, length 0
21:27:46.567434 IP 194.147.140.82.48971 > 143.110.223.72.5490: Flags [S], seq 3958662822, win 1024, length 0
21:27:47.288165 IP 143.110.223.72.55586 > golem.canonical.com.ntp: NTPv4, Client, length 48
21:27:47.366688 IP golem.canonical.com.ntp > 143.110.223.72.55586: NTPv4, Server, length 48
21:27:47.815534 IP 185.236.11.150.49341 > 143.110.223.72.15525: Flags [S], seq 4207721320, win 1024, length 0
21:27:50.367947 IP 185.236.11.34.49689 > 143.110.223.72.25354: Flags [S], seq 633149595, win 1024, length 0
21:28:01.381221 IP 185.173.35.17.netsystemsresearch.com.60377 > 143.110.223.72.47808: UDP, length 17
21:28:08.908276 IP cpe9050ca275d83-cm9050ca275d80.cpe.net.cable.rogers.com.53170 > 143.110.223.72.http-alt: Flags [S], seq 2801913935, win 64240, options [mss 1460,nop,wscale 8,nop,nop,sackOK], length 0
21:28:09.835870 IP cpe9050ca275d83-cm9050ca275d80.cpe.net.cable.rogers.com.53170 > 143.110.223.72.http-alt: Flags [S], seq 2801913935, win 64240, options [mss 1460,nop,wscale 8,nop,nop,sackOK], length 0
21:28:10.523658 IP 185.236.11.150.49341 > 143.110.223.72.15734: Flags [S], seq 680954584, win 1024, length 0
21:28:11.854485 IP cpe9050ca275d83-cm9050ca275d80.cpe.net.cable.rogers.com.53170 > 143.110.223.72.http-alt: Flags [S], seq 2801913935, win 64240, options [mss 1460,nop,wscale 8,nop,nop,sackOK], length 0
21:28:23.603598 IP 194.147.140.88.48772 > 143.110.223.72.ftp: Flags [S], seq 801290025, win 1024, length 0
21:28:28.574768 IP 194.147.140.32.48073 > 143.110.223.72.3285: Flags [S], seq 858683233, win 1024, length 0
21:28:31.741768 IP 194.147.140.88.48772 > 143.110.223.72.login: Flags [S], seq 2170082079, win 1024, length 0
21:28:32.865173 IP 185.236.11.34.49689 > 143.110.223.72.25492: Flags [S], seq 1473139880, win 1024, length 0
21:28:46.348891 IP 194.147.140.82.48971 > 143.110.223.72.5376: Flags [S], seq 2897458130, win 1024, length 0
21:28:48.029251 IP cpe9050ca275d83-cm9050ca275d80.cpe.net.cable.rogers.com.53203 > 143.110.223.72.http-alt: Flags [S], seq 3604154177, win 64240, options [mss 1460,nop,wscale 8,nop,nop,sackOK], length 0
21:28:48.967182 IP cpe9050ca275d83-cm9050ca275d80.cpe.net.cable.rogers.com.53203 > 143.110.223.72.http-alt: Flags [S], seq 3604154177, win 64240, options [mss 1460,nop,wscale 8,nop,nop,sackOK], length 0
21:28:49.565462 IP cpe9050ca275d83-cm9050ca275d80.cpe.net.cable.rogers.com.53204 > 143.110.223.72.http-alt: Flags [S], seq 230381447, win 64240, options [mss 1460,nop,wscale 8,nop,nop,sackOK], length 0
21:28:50.030042 IP cpe9050ca275d83-cm9050ca275d80.cpe.net.cable.rogers.com.53205 > 143.110.223.72.http-alt: Flags [S], seq 3631772234, win 64240, options [mss 1460,nop,wscale 8,nop,nop,sackOK], length 0
21:28:50.389781 IP cpe9050ca275d83-cm9050ca275d80.cpe.net.cable.rogers.com.53206 > 143.110.223.72.http-alt: Flags [S], seq 927802557, win 64240, options [mss 1460,nop,wscale 8,nop,nop,sackOK], length 0
21:28:50.583084 IP cpe9050ca275d83-cm9050ca275d80.cpe.net.cable.rogers.com.53204 > 143.110.223.72.http-alt: Flags [S], seq 230381447, win 64240, options [mss 1460,nop,wscale 8,nop,nop,sackOK], length 0
21:28:51.017051 IP cpe9050ca275d83-cm9050ca275d80.cpe.net.cable.rogers.com.53203 > 143.110.223.72.http-alt: Flags [S], seq 3604154177, win 64240, options [mss 1460,nop,wscale 8,nop,nop,sackOK], length 0
21:28:51.049204 IP cpe9050ca275d83-cm9050ca275d80.cpe.net.cable.rogers.com.53205 > 143.110.223.72.http-alt: Flags [S], seq 3631772234, win 64240, options [mss 1460,nop,wscale 8,nop,nop,sackOK], length 0
21:28:51.076724 IP 79.124.62.74.http-alt > 143.110.223.72.4642: Flags [S], seq 2248255362, win 1024, length 0
21:28:51.402283 IP cpe9050ca275d83-cm9050ca275d80.cpe.net.cable.rogers.com.53206 > 143.110.223.72.http-alt: Flags [S], seq 927802557, win 64240, options [mss 1460,nop,wscale 8,nop,nop,sackOK], length 0
21:28:52.511968 IP cpe9050ca275d83-cm9050ca275d80.cpe.net.cable.rogers.com.53204 > 143.110.223.72.http-alt: Flags [S], seq 230381447, win 64240, options [mss 1460,nop,wscale 8,nop,nop,sackOK], length 0
21:28:52.979615 IP cpe9050ca275d83-cm9050ca275d80.cpe.net.cable.rogers.com.53205 > 143.110.223.72.http-alt: Flags [S], seq 3631772234, win 64240, options [mss 1460,nop,wscale 8,nop,nop,sackOK], length 0
21:28:53.329932 IP cpe9050ca275d83-cm9050ca275d80.cpe.net.cable.rogers.com.53206 > 143.110.223.72.http-alt: Flags [S], seq 927802557, win 64240, options [mss 1460,nop,wscale 8,nop,nop,sackOK], length 0
21:29:01.399055 IP 195.54.161.150.42266 > 143.110.223.72.26780: Flags [S], seq 16657770, win 1024, length 0
21:29:02.684686 IP 194.147.140.82.48971 > 143.110.223.72.5274: Flags [S], seq 1796492574, win 1024, length 0
21:29:03.366261 IP 185.236.11.150.49341 > 143.110.223.72.15780: Flags [S], seq 1550873020, win 1024, length 0
21:29:05.599139 IP 209.141.55.141.37862 > 143.110.223.72.domain: 50293+ [1au] ANY? . (33)
21:29:08.277935 IP 79.124.62.74.http-alt > 143.110.223.72.2300: Flags [S], seq 2741045084, win 1024, length 0
21:29:12.871834 IP cpe9050ca275d83-cm9050ca275d80.cpe.net.cable.rogers.com.53207 > 143.110.223.72.http: Flags [S], seq 3938453231, win 64240, options [mss 1460,nop,wscale 8,nop,nop,sackOK], length 0
21:29:12.871939 IP 143.110.223.72.http > cpe9050ca275d83-cm9050ca275d80.cpe.net.cable.rogers.com.53207: Flags [S.], seq 898956104, ack 3938453232, win 64240, options [mss 1460,nop,nop,sackOK,nop,wscale 7], length 0
21:29:12.983621 IP cpe9050ca275d83-cm9050ca275d80.cpe.net.cable.rogers.com.53207 > 143.110.223.72.http: Flags [.], ack 1, win 513, length 0
21:29:12.983704 IP cpe9050ca275d83-cm9050ca275d80.cpe.net.cable.rogers.com.53207 > 143.110.223.72.http: Flags [P.], seq 1:9, ack 1, win 513, length 8: HTTP
21:29:12.983761 IP 143.110.223.72.http > cpe9050ca275d83-cm9050ca275d80.cpe.net.cable.rogers.com.53207: Flags [.], ack 9, win 502, length 0
21:29:13.489253 IP cpe9050ca275d83-cm9050ca275d80.cpe.net.cable.rogers.com.53207 > 143.110.223.72.http: Flags [F.], seq 9, ack 1, win 513, length 0
21:29:13.489429 IP 143.110.223.72.http > cpe9050ca275d83-cm9050ca275d80.cpe.net.cable.rogers.com.53207: Flags [F.], seq 1, ack 10, win 502, length 0
21:29:13.615095 IP cpe9050ca275d83-cm9050ca275d80.cpe.net.cable.rogers.com.53207 > 143.110.223.72.http: Flags [.], ack 2, win 513, length 0
21:29:14.731719 IP 79.124.62.74.http-alt > 143.110.223.72.5548: Flags [S], seq 1642538521, win 1024, length 0
21:29:17.872105 IP cpe9050ca275d83-cm9050ca275d80.cpe.net.cable.rogers.com.53208 > 143.110.223.72.http: Flags [S], seq 37020827, win 64240, options [mss 1460,nop,wscale 8,nop,nop,sackOK], length 0
21:29:17.872236 IP 143.110.223.72.http > cpe9050ca275d83-cm9050ca275d80.cpe.net.cable.rogers.com.53208: Flags [S.], seq 834768694, ack 37020828, win 64240, options [mss 1460,nop,nop,sackOK,nop,wscale 7], length 0
21:29:18.014313 IP cpe9050ca275d83-cm9050ca275d80.cpe.net.cable.rogers.com.53208 > 143.110.223.72.http: Flags [.], ack 1, win 513, length 0
21:29:18.016162 IP cpe9050ca275d83-cm9050ca275d80.cpe.net.cable.rogers.com.53208 > 143.110.223.72.http: Flags [P.], seq 1:9, ack 1, win 513, length 8: HTTP
21:29:18.016239 IP 143.110.223.72.http > cpe9050ca275d83-cm9050ca275d80.cpe.net.cable.rogers.com.53208: Flags [.], ack 9, win 502, length 0
21:29:18.170673 IP cpe9050ca275d83-cm9050ca275d80.cpe.net.cable.rogers.com.53209 > 143.110.223.72.http: Flags [S], seq 1495559910, win 64240, options [mss 1460,nop,wscale 8,nop,nop,sackOK], length 0
21:29:18.170793 IP 143.110.223.72.http > cpe9050ca275d83-cm9050ca275d80.cpe.net.cable.rogers.com.53209: Flags [S.], seq 1066418639, ack 1495559911, win 64240, options [mss 1460,nop,nop,sackOK,nop,wscale 7], length 0
21:29:18.313668 IP cpe9050ca275d83-cm9050ca275d80.cpe.net.cable.rogers.com.53209 > 143.110.223.72.http: Flags [.], ack 1, win 513, length 0
21:29:18.315818 IP cpe9050ca275d83-cm9050ca275d80.cpe.net.cable.rogers.com.53209 > 143.110.223.72.http: Flags [P.], seq 1:9, ack 1, win 513, length 8: HTTP
21:29:18.315930 IP 143.110.223.72.http > cpe9050ca275d83-cm9050ca275d80.cpe.net.cable.rogers.com.53209: Flags [.], ack 9, win 502, length 0
21:29:18.395551 IP cpe9050ca275d83-cm9050ca275d80.cpe.net.cable.rogers.com.53210 > 143.110.223.72.http: Flags [S], seq 3055400904, win 64240, options [mss 1460,nop,wscale 8,nop,nop,sackOK], length 0
21:29:18.395664 IP 143.110.223.72.http > cpe9050ca275d83-cm9050ca275d80.cpe.net.cable.rogers.com.53210: Flags [S.], seq 54212909, ack 3055400905, win 64240, options [mss 1460,nop,nop,sackOK,nop,wscale 7], length 0
21:29:18.514389 IP cpe9050ca275d83-cm9050ca275d80.cpe.net.cable.rogers.com.53208 > 143.110.223.72.http: Flags [F.], seq 9, ack 1, win 513, length 0
21:29:18.514586 IP 143.110.223.72.http > cpe9050ca275d83-cm9050ca275d80.cpe.net.cable.rogers.com.53208: Flags [F.], seq 1, ack 10, win 502, length 0
21:29:18.537814 IP cpe9050ca275d83-cm9050ca275d80.cpe.net.cable.rogers.com.53210 > 143.110.223.72.http: Flags [.], ack 1, win 513, length 0
21:29:18.540756 IP cpe9050ca275d83-cm9050ca275d80.cpe.net.cable.rogers.com.53210 > 143.110.223.72.http: Flags [P.], seq 1:9, ack 1, win 513, length 8: HTTP
21:29:18.540835 IP 143.110.223.72.http > cpe9050ca275d83-cm9050ca275d80.cpe.net.cable.rogers.com.53210: Flags [.], ack 9, win 502, length 0
21:29:18.659985 IP cpe9050ca275d83-cm9050ca275d80.cpe.net.cable.rogers.com.53208 > 143.110.223.72.http: Flags [.], ack 2, win 513, length 0
21:29:18.817539 IP cpe9050ca275d83-cm9050ca275d80.cpe.net.cable.rogers.com.53209 > 143.110.223.72.http: Flags [F.], seq 9, ack 1, win 513, length 0
21:29:18.817725 IP 143.110.223.72.http > cpe9050ca275d83-cm9050ca275d80.cpe.net.cable.rogers.com.53209: Flags [F.], seq 1, ack 10, win 502, length 0
21:29:18.967925 IP cpe9050ca275d83-cm9050ca275d80.cpe.net.cable.rogers.com.53209 > 143.110.223.72.http: Flags [.], ack 2, win 513, length 0
21:29:19.053850 IP cpe9050ca275d83-cm9050ca275d80.cpe.net.cable.rogers.com.53210 > 143.110.223.72.http: Flags [F.], seq 9, ack 1, win 513, length 0
21:29:19.054106 IP 143.110.223.72.http > cpe9050ca275d83-cm9050ca275d80.cpe.net.cable.rogers.com.53210: Flags [F.], seq 1, ack 10, win 502, length 0
21:29:19.191360 IP cpe9050ca275d83-cm9050ca275d80.cpe.net.cable.rogers.com.53210 > 143.110.223.72.http: Flags [.], ack 2, win 513, length 0
21:29:19.329695 IP 194.147.140.88.48772 > 143.110.223.72.51: Flags [S], seq 641575203, win 1024, length 0
21:29:21.093541 IP 185.236.11.34.49689 > 143.110.223.72.25599: Flags [S], seq 2791202067, win 1024, length 0
21:29:25.142648 IP 194.147.140.88.48772 > 143.110.223.72.150: Flags [S], seq 1999248102, win 1024, length 0
21:29:27.163215 IP cpe9050ca275d83-cm9050ca275d80.cpe.net.cable.rogers.com.53213 > 143.110.223.72.http: Flags [S], seq 3347282970, win 64240, options [mss 1460,nop,wscale 8,nop,nop,sackOK], length 0
21:29:27.163317 IP 143.110.223.72.http > cpe9050ca275d83-cm9050ca275d80.cpe.net.cable.rogers.com.53213: Flags [S.], seq 510276803, ack 3347282971, win 64240, options [mss 1460,nop,nop,sackOK,nop,wscale 7], length 0
21:29:27.348929 IP cpe9050ca275d83-cm9050ca275d80.cpe.net.cable.rogers.com.53213 > 143.110.223.72.http: Flags [.], ack 1, win 513, length 0
21:29:27.351080 IP cpe9050ca275d83-cm9050ca275d80.cpe.net.cable.rogers.com.53213 > 143.110.223.72.http: Flags [P.], seq 1:9, ack 1, win 513, length 8: HTTP
21:29:27.351182 IP 143.110.223.72.http > cpe9050ca275d83-cm9050ca275d80.cpe.net.cable.rogers.com.53213: Flags [.], ack 9, win 502, length 0
21:29:27.689694 IP cpe9050ca275d83-cm9050ca275d80.cpe.net.cable.rogers.com.53214 > 143.110.223.72.http: Flags [S], seq 145437600, win 64240, options [mss 1460,nop,wscale 8,nop,nop,sackOK], length 0
21:29:27.689806 IP 143.110.223.72.http > cpe9050ca275d83-cm9050ca275d80.cpe.net.cable.rogers.com.53214: Flags [S.], seq 719375225, ack 145437601, win 64240, options [mss 1460,nop,nop,sackOK,nop,wscale 7], length 0
21:29:27.860859 IP cpe9050ca275d83-cm9050ca275d80.cpe.net.cable.rogers.com.53213 > 143.110.223.72.http: Flags [F.], seq 9, ack 1, win 513, length 0
21:29:27.861041 IP 143.110.223.72.http > cpe9050ca275d83-cm9050ca275d80.cpe.net.cable.rogers.com.53213: Flags [F.], seq 1, ack 10, win 502, length 0
21:29:27.878778 IP cpe9050ca275d83-cm9050ca275d80.cpe.net.cable.rogers.com.53214 > 143.110.223.72.http: Flags [.], ack 1, win 513, length 0
21:29:27.881178 IP cpe9050ca275d83-cm9050ca275d80.cpe.net.cable.rogers.com.53214 > 143.110.223.72.http: Flags [P.], seq 1:9, ack 1, win 513, length 8: HTTP
21:29:27.881243 IP 143.110.223.72.http > cpe9050ca275d83-cm9050ca275d80.cpe.net.cable.rogers.com.53214: Flags [.], ack 9, win 502, length 0
21:29:27.991737 IP cpe9050ca275d83-cm9050ca275d80.cpe.net.cable.rogers.com.53215 > 143.110.223.72.http: Flags [S], seq 2854399434, win 64240, options [mss 1460,nop,wscale 8,nop,nop,sackOK], length 0
21:29:27.991846 IP 143.110.223.72.http > cpe9050ca275d83-cm9050ca275d80.cpe.net.cable.rogers.com.53215: Flags [S.], seq 2182846383, ack 2854399435, win 64240, options [mss 1460,nop,nop,sackOK,nop,wscale 7], length 0
21:29:28.010342 IP cpe9050ca275d83-cm9050ca275d80.cpe.net.cable.rogers.com.53215 > 143.110.223.72.http: Flags [P.], seq 1:9, ack 1, win 513, length 8: HTTP
21:29:28.010448 IP 143.110.223.72.http > cpe9050ca275d83-cm9050ca275d80.cpe.net.cable.rogers.com.53215: Flags [.], ack 9, win 502, length 0
21:29:28.049725 IP cpe9050ca275d83-cm9050ca275d80.cpe.net.cable.rogers.com.53213 > 143.110.223.72.http: Flags [.], ack 2, win 513, length 0
21:29:28.178590 IP cpe9050ca275d83-cm9050ca275d80.cpe.net.cable.rogers.com.53216 > 143.110.223.72.http: Flags [S], seq 4268634426, win 64240, options [mss 1460,nop,wscale 8,nop,nop,sackOK], length 0
21:29:28.178687 IP 143.110.223.72.http > cpe9050ca275d83-cm9050ca275d80.cpe.net.cable.rogers.com.53216: Flags [S.], seq 2923002752, ack 4268634427, win 64240, options [mss 1460,nop,nop,sackOK,nop,wscale 7], length 0
21:29:28.196288 IP cpe9050ca275d83-cm9050ca275d80.cpe.net.cable.rogers.com.53215 > 143.110.223.72.http: Flags [.], ack 1, win 513, length 0
21:29:28.196354 IP 143.110.223.72.http > cpe9050ca275d83-cm9050ca275d80.cpe.net.cable.rogers.com.53215: Flags [.], ack 9, win 502, length 0
21:29:28.357238 IP cpe9050ca275d83-cm9050ca275d80.cpe.net.cable.rogers.com.53217 > 143.110.223.72.http: Flags [S], seq 2996492162, win 64240, options [mss 1460,nop,wscale 8,nop,nop,sackOK], length 0
21:29:28.357381 IP 143.110.223.72.http > cpe9050ca275d83-cm9050ca275d80.cpe.net.cable.rogers.com.53217: Flags [S.], seq 4014007213, ack 2996492163, win 64240, options [mss 1460,nop,nop,sackOK,nop,wscale 7], length 0
21:29:28.399740 IP cpe9050ca275d83-cm9050ca275d80.cpe.net.cable.rogers.com.53216 > 143.110.223.72.http: Flags [.], ack 1, win 513, length 0
21:29:28.399816 IP cpe9050ca275d83-cm9050ca275d80.cpe.net.cable.rogers.com.53216 > 143.110.223.72.http: Flags [P.], seq 1:9, ack 1, win 513, length 8: HTTP
21:29:28.399880 IP 143.110.223.72.http > cpe9050ca275d83-cm9050ca275d80.cpe.net.cable.rogers.com.53216: Flags [.], ack 9, win 502, length 0
21:29:28.406501 IP cpe9050ca275d83-cm9050ca275d80.cpe.net.cable.rogers.com.53214 > 143.110.223.72.http: Flags [F.], seq 9, ack 1, win 513, length 0
21:29:28.406650 IP 143.110.223.72.http > cpe9050ca275d83-cm9050ca275d80.cpe.net.cable.rogers.com.53214: Flags [F.], seq 1, ack 10, win 502, length 0
21:29:28.512498 IP cpe9050ca275d83-cm9050ca275d80.cpe.net.cable.rogers.com.53218 > 143.110.223.72.http: Flags [S], seq 1013328290, win 64240, options [mss 1460,nop,wscale 8,nop,nop,sackOK], length 0
21:29:28.512614 IP 143.110.223.72.http > cpe9050ca275d83-cm9050ca275d80.cpe.net.cable.rogers.com.53218: Flags [S.], seq 3006511084, ack 1013328291, win 64240, options [mss 1460,nop,nop,sackOK,nop,wscale 7], length 0
21:29:28.564799 IP cpe9050ca275d83-cm9050ca275d80.cpe.net.cable.rogers.com.53217 > 143.110.223.72.http: Flags [.], ack 1, win 513, length 0
21:29:28.565910 IP cpe9050ca275d83-cm9050ca275d80.cpe.net.cable.rogers.com.53217 > 143.110.223.72.http: Flags [P.], seq 1:9, ack 1, win 513, length 8: HTTP
21:29:28.565980 IP 143.110.223.72.http > cpe9050ca275d83-cm9050ca275d80.cpe.net.cable.rogers.com.53217: Flags [.], ack 9, win 502, length 0
21:29:28.616836 IP cpe9050ca275d83-cm9050ca275d80.cpe.net.cable.rogers.com.53214 > 143.110.223.72.http: Flags [.], ack 2, win 513, length 0
21:29:28.735496 IP cpe9050ca275d83-cm9050ca275d80.cpe.net.cable.rogers.com.53219 > 143.110.223.72.http: Flags [S], seq 814024415, win 64240, options [mss 1460,nop,wscale 8,nop,nop,sackOK], length 0
21:29:28.735599 IP 143.110.223.72.http > cpe9050ca275d83-cm9050ca275d80.cpe.net.cable.rogers.com.53219: Flags [S.], seq 2734551914, ack 814024416, win 64240, options [mss 1460,nop,nop,sackOK,nop,wscale 7], length 0
21:29:28.737774 IP cpe9050ca275d83-cm9050ca275d80.cpe.net.cable.rogers.com.53215 > 143.110.223.72.http: Flags [F.], seq 9, ack 1, win 513, length 0
21:29:28.737929 IP 143.110.223.72.http > cpe9050ca275d83-cm9050ca275d80.cpe.net.cable.rogers.com.53215: Flags [F.], seq 1, ack 10, win 502, length 0
21:29:28.746680 IP cpe9050ca275d83-cm9050ca275d80.cpe.net.cable.rogers.com.53218 > 143.110.223.72.http: Flags [.], ack 1, win 513, length 0
21:29:28.746706 IP cpe9050ca275d83-cm9050ca275d80.cpe.net.cable.rogers.com.53218 > 143.110.223.72.http: Flags [P.], seq 1:9, ack 1, win 513, length 8: HTTP
21:29:28.746740 IP 143.110.223.72.http > cpe9050ca275d83-cm9050ca275d80.cpe.net.cable.rogers.com.53218: Flags [.], ack 9, win 502, length 0
21:29:28.879588 IP cpe9050ca275d83-cm9050ca275d80.cpe.net.cable.rogers.com.53220 > 143.110.223.72.http: Flags [S], seq 3900157187, win 64240, options [mss 1460,nop,wscale 8,nop,nop,sackOK], length 0
21:29:28.879705 IP 143.110.223.72.http > cpe9050ca275d83-cm9050ca275d80.cpe.net.cable.rogers.com.53220: Flags [S.], seq 64010657, ack 3900157188, win 64240, options [mss 1460,nop,nop,sackOK,nop,wscale 7], length 0
21:29:28.907340 IP cpe9050ca275d83-cm9050ca275d80.cpe.net.cable.rogers.com.53216 > 143.110.223.72.http: Flags [F.], seq 9, ack 1, win 513, length 0
21:29:28.907513 IP 143.110.223.72.http > cpe9050ca275d83-cm9050ca275d80.cpe.net.cable.rogers.com.53216: Flags [F.], seq 1, ack 10, win 502, length 0
21:29:28.950330 IP cpe9050ca275d83-cm9050ca275d80.cpe.net.cable.rogers.com.53219 > 143.110.223.72.http: Flags [.], ack 1, win 513, length 0
21:29:28.952589 IP cpe9050ca275d83-cm9050ca275d80.cpe.net.cable.rogers.com.53219 > 143.110.223.72.http: Flags [P.], seq 1:9, ack 1, win 513, length 8: HTTP
21:29:28.952662 IP 143.110.223.72.http > cpe9050ca275d83-cm9050ca275d80.cpe.net.cable.rogers.com.53219: Flags [.], ack 9, win 502, length 0
21:29:28.954197 IP cpe9050ca275d83-cm9050ca275d80.cpe.net.cable.rogers.com.53215 > 143.110.223.72.http: Flags [.], ack 2, win 513, length 0
21:29:29.051299 IP cpe9050ca275d83-cm9050ca275d80.cpe.net.cable.rogers.com.53221 > 143.110.223.72.http: Flags [S], seq 3366501695, win 64240, options [mss 1460,nop,wscale 8,nop,nop,sackOK], length 0
21:29:29.051421 IP 143.110.223.72.http > cpe9050ca275d83-cm9050ca275d80.cpe.net.cable.rogers.com.53221: Flags [S.], seq 3422085015, ack 3366501696, win 64240, options [mss 1460,nop,nop,sackOK,nop,wscale 7], length 0
21:29:29.069398 IP cpe9050ca275d83-cm9050ca275d80.cpe.net.cable.rogers.com.53217 > 143.110.223.72.http: Flags [F.], seq 9, ack 1, win 513, length 0
21:29:29.069702 IP 143.110.223.72.http > cpe9050ca275d83-cm9050ca275d80.cpe.net.cable.rogers.com.53217: Flags [F.], seq 1, ack 10, win 502, length 0
21:29:29.072617 IP cpe9050ca275d83-cm9050ca275d80.cpe.net.cable.rogers.com.53221 > 143.110.223.72.http: Flags [P.], seq 1:9, ack 1, win 513, length 8: HTTP
21:29:29.072710 IP 143.110.223.72.http > cpe9050ca275d83-cm9050ca275d80.cpe.net.cable.rogers.com.53221: Flags [.], ack 9, win 502, length 0
21:29:29.092834 IP cpe9050ca275d83-cm9050ca275d80.cpe.net.cable.rogers.com.53220 > 143.110.223.72.http: Flags [.], ack 1, win 513, length 0
21:29:29.097053 IP cpe9050ca275d83-cm9050ca275d80.cpe.net.cable.rogers.com.53220 > 143.110.223.72.http: Flags [P.], seq 1:9, ack 1, win 513, length 8: HTTP
21:29:29.097127 IP 143.110.223.72.http > cpe9050ca275d83-cm9050ca275d80.cpe.net.cable.rogers.com.53220: Flags [.], ack 9, win 502, length 0
21:29:29.126879 IP cpe9050ca275d83-cm9050ca275d80.cpe.net.cable.rogers.com.53216 > 143.110.223.72.http: Flags [.], ack 2, win 513, length 0
21:29:29.200305 IP cpe9050ca275d83-cm9050ca275d80.cpe.net.cable.rogers.com.53222 > 143.110.223.72.http: Flags [S], seq 153572791, win 64240, options [mss 1460,nop,wscale 8,nop,nop,sackOK], length 0
21:29:29.200405 IP 143.110.223.72.http > cpe9050ca275d83-cm9050ca275d80.cpe.net.cable.rogers.com.53222: Flags [S.], seq 400052982, ack 153572792, win 64240, options [mss 1460,nop,nop,sackOK,nop,wscale 7], length 0
21:29:29.218789 IP cpe9050ca275d83-cm9050ca275d80.cpe.net.cable.rogers.com.53218 > 143.110.223.72.http: Flags [F.], seq 9, ack 1, win 513, length 0
21:29:29.218972 IP 143.110.223.72.http > cpe9050ca275d83-cm9050ca275d80.cpe.net.cable.rogers.com.53218: Flags [F.], seq 1, ack 10, win 502, length 0
21:29:29.220688 IP cpe9050ca275d83-cm9050ca275d80.cpe.net.cable.rogers.com.53222 > 143.110.223.72.http: Flags [P.], seq 1:9, ack 1, win 513, length 8: HTTP
21:29:29.220775 IP 143.110.223.72.http > cpe9050ca275d83-cm9050ca275d80.cpe.net.cable.rogers.com.53222: Flags [.], ack 9, win 502, length 0
21:29:29.252479 IP cpe9050ca275d83-cm9050ca275d80.cpe.net.cable.rogers.com.53221 > 143.110.223.72.http: Flags [.], ack 1, win 513, length 0
21:29:29.252556 IP 143.110.223.72.http > cpe9050ca275d83-cm9050ca275d80.cpe.net.cable.rogers.com.53221: Flags [.], ack 9, win 502, length 0
21:29:29.267506 IP cpe9050ca275d83-cm9050ca275d80.cpe.net.cable.rogers.com.53217 > 143.110.223.72.http: Flags [.], ack 2, win 513, length 0
21:29:29.345266 IP cpe9050ca275d83-cm9050ca275d80.cpe.net.cable.rogers.com.53223 > 143.110.223.72.http: Flags [S], seq 3607215559, win 64240, options [mss 1460,nop,wscale 8,nop,nop,sackOK], length 0
21:29:29.345368 IP 143.110.223.72.http > cpe9050ca275d83-cm9050ca275d80.cpe.net.cable.rogers.com.53223: Flags [S.], seq 932841729, ack 3607215560, win 64240, options [mss 1460,nop,nop,sackOK,nop,wscale 7], length 0
21:29:29.367658 IP cpe9050ca275d83-cm9050ca275d80.cpe.net.cable.rogers.com.53223 > 143.110.223.72.http: Flags [P.], seq 1:9, ack 1, win 513, length 8: HTTP
21:29:29.367778 IP 143.110.223.72.http > cpe9050ca275d83-cm9050ca275d80.cpe.net.cable.rogers.com.53223: Flags [.], ack 9, win 502, length 0
21:29:29.411965 IP cpe9050ca275d83-cm9050ca275d80.cpe.net.cable.rogers.com.53222 > 143.110.223.72.http: Flags [.], ack 1, win 513, length 0
21:29:29.412049 IP 143.110.223.72.http > cpe9050ca275d83-cm9050ca275d80.cpe.net.cable.rogers.com.53222: Flags [.], ack 9, win 502, length 0
21:29:29.429758 IP cpe9050ca275d83-cm9050ca275d80.cpe.net.cable.rogers.com.53218 > 143.110.223.72.http: Flags [.], ack 2, win 513, length 0
21:29:29.449449 IP cpe9050ca275d83-cm9050ca275d80.cpe.net.cable.rogers.com.53219 > 143.110.223.72.http: Flags [F.], seq 9, ack 1, win 513, length 0
21:29:29.449603 IP 143.110.223.72.http > cpe9050ca275d83-cm9050ca275d80.cpe.net.cable.rogers.com.53219: Flags [F.], seq 1, ack 10, win 502, length 0
21:29:29.562529 IP cpe9050ca275d83-cm9050ca275d80.cpe.net.cable.rogers.com.53223 > 143.110.223.72.http: Flags [.], ack 1, win 513, length 0
21:29:29.562619 IP 143.110.223.72.http > cpe9050ca275d83-cm9050ca275d80.cpe.net.cable.rogers.com.53223: Flags [.], ack 9, win 502, length 0
21:29:29.562919 IP 185.141.170.43.45306 > 143.110.223.72.ssh: Flags [S], seq 3480331671, win 29200, options [mss 1460,sackOK,TS val 117505829 ecr 0,nop,wscale 7], length 0
21:29:29.562995 IP 143.110.223.72.ssh > 185.141.170.43.45306: Flags [S.], seq 1850181984, ack 3480331672, win 65160, options [mss 1460,sackOK,TS val 937388473 ecr 117505829,nop,wscale 7], length 0
21:29:29.598218 IP cpe9050ca275d83-cm9050ca275d80.cpe.net.cable.rogers.com.53220 > 143.110.223.72.http: Flags [F.], seq 9, ack 1, win 513, length 0
21:29:29.598393 IP 143.110.223.72.http > cpe9050ca275d83-cm9050ca275d80.cpe.net.cable.rogers.com.53220: Flags [F.], seq 1, ack 10, win 502, length 0
21:29:29.671643 IP cpe9050ca275d83-cm9050ca275d80.cpe.net.cable.rogers.com.53219 > 143.110.223.72.http: Flags [.], ack 2, win 513, length 0
21:29:29.787282 IP cpe9050ca275d83-cm9050ca275d80.cpe.net.cable.rogers.com.53221 > 143.110.223.72.http: Flags [F.], seq 9, ack 1, win 513, length 0
21:29:29.787462 IP 143.110.223.72.http > cpe9050ca275d83-cm9050ca275d80.cpe.net.cable.rogers.com.53221: Flags [F.], seq 1, ack 10, win 502, length 0
21:29:29.822956 IP cpe9050ca275d83-cm9050ca275d80.cpe.net.cable.rogers.com.53220 > 143.110.223.72.http: Flags [.], ack 2, win 513, length 0
21:29:29.844961 IP 185.141.170.43.45306 > 143.110.223.72.ssh: Flags [.], ack 1, win 229, options [nop,nop,TS val 117505900 ecr 937388473], length 0
21:29:29.868447 IP 143.110.223.72.ssh > 185.141.170.43.45306: Flags [P.], seq 1:42, ack 1, win 510, options [nop,nop,TS val 937388779 ecr 117505900], length 41
21:29:29.935408 IP cpe9050ca275d83-cm9050ca275d80.cpe.net.cable.rogers.com.53222 > 143.110.223.72.http: Flags [F.], seq 9, ack 1, win 513, length 0
21:29:29.935618 IP 143.110.223.72.http > cpe9050ca275d83-cm9050ca275d80.cpe.net.cable.rogers.com.53222: Flags [F.], seq 1, ack 10, win 502, length 0
21:29:30.015210 IP cpe9050ca275d83-cm9050ca275d80.cpe.net.cable.rogers.com.53221 > 143.110.223.72.http: Flags [.], ack 2, win 513, length 0
21:29:30.083609 IP cpe9050ca275d83-cm9050ca275d80.cpe.net.cable.rogers.com.53223 > 143.110.223.72.http: Flags [F.], seq 9, ack 1, win 513, length 0
21:29:30.083797 IP 143.110.223.72.http > cpe9050ca275d83-cm9050ca275d80.cpe.net.cable.rogers.com.53223: Flags [F.], seq 1, ack 10, win 502, length 0
21:29:30.149642 IP 185.141.170.43.45306 > 143.110.223.72.ssh: Flags [.], ack 42, win 229, options [nop,nop,TS val 117505976 ecr 937388779], length 0
21:29:30.149824 IP 185.141.170.43.45306 > 143.110.223.72.ssh: Flags [F.], seq 1, ack 42, win 229, options [nop,nop,TS val 117505976 ecr 937388779], length 0
21:29:30.149916 IP 143.110.223.72.ssh > 185.141.170.43.45306: Flags [.], ack 2, win 510, options [nop,nop,TS val 937389060 ecr 117505976], length 0
21:29:30.156266 IP 143.110.223.72.ssh > 185.141.170.43.45306: Flags [F.], seq 42, ack 2, win 510, options [nop,nop,TS val 937389067 ecr 117505976], length 0
21:29:30.164112 IP cpe9050ca275d83-cm9050ca275d80.cpe.net.cable.rogers.com.53222 > 143.110.223.72.http: Flags [.], ack 2, win 513, length 0
21:29:30.315200 IP cpe9050ca275d83-cm9050ca275d80.cpe.net.cable.rogers.com.53223 > 143.110.223.72.http: Flags [.], ack 2, win 513, length 0
21:29:30.437975 IP 185.141.170.43.45306 > 143.110.223.72.ssh: Flags [.], ack 43, win 229, options [nop,nop,TS val 117506048 ecr 937389067], length 0
21:29:32.112345 IP broadband.actcorp.in.52220 > 143.110.223.72.microsoft-ds: Flags [S], seq 3451487967, win 8192, options [mss 1460,nop,wscale 2,nop,nop,sackOK], length 0
21:29:32.867676 IP 185.236.11.34.49689 > 143.110.223.72.25381: Flags [S], seq 3802609630, win 1024, length 0
21:29:33.536047 IP 122.228.19.79.33315 > 143.110.223.72.2424: Flags [S], seq 3022726768, win 29200, options [mss 1460], length 0
21:29:47.840651 IP 185.236.11.200.49516 > 143.110.223.72.20852: Flags [S], seq 455278365, win 1024, length 0
21:29:49.020235 IP 185.236.11.34.49689 > 143.110.223.72.25332: Flags [S], seq 1099404195, win 1024, length 0
21:29:50.798661 IP 185.236.11.34.49689 > 143.110.223.72.25566: Flags [S], seq 3651409115, win 1024, length 0
21:29:58.217112 IP 194.147.140.82.48971 > 143.110.223.72.5581: Flags [S], seq 3095349696, win 1024, length 0
21:30:14.829799 IP cpe9050ca275d83-cm9050ca275d80.cpe.net.cable.rogers.com.53228 > 143.110.223.72.http: Flags [S], seq 3724745995, win 64240, options [mss 1460,nop,wscale 8,nop,nop,sackOK], length 0
21:30:14.829903 IP 143.110.223.72.http > cpe9050ca275d83-cm9050ca275d80.cpe.net.cable.rogers.com.53228: Flags [S.], seq 4262710830, ack 3724745996, win 64240, options [mss 1460,nop,nop,sackOK,nop,wscale 7], length 0
21:30:14.844779 IP cpe9050ca275d83-cm9050ca275d80.cpe.net.cable.rogers.com.53228 > 143.110.223.72.http: Flags [.], ack 1, win 513, length 0
21:30:14.849579 IP cpe9050ca275d83-cm9050ca275d80.cpe.net.cable.rogers.com.53228 > 143.110.223.72.http: Flags [.], seq 1:1461, ack 1, win 513, length 1460: HTTP
21:30:14.849666 IP 143.110.223.72.http > cpe9050ca275d83-cm9050ca275d80.cpe.net.cable.rogers.com.53228: Flags [.], ack 1461, win 501, length 0
21:30:14.849918 IP cpe9050ca275d83-cm9050ca275d80.cpe.net.cable.rogers.com.53228 > 143.110.223.72.http: Flags [.], seq 1461:2921, ack 1, win 513, length 1460: HTTP
21:30:14.849948 IP 143.110.223.72.http > cpe9050ca275d83-cm9050ca275d80.cpe.net.cable.rogers.com.53228: Flags [.], ack 2921, win 501, length 0
21:30:14.850230 IP cpe9050ca275d83-cm9050ca275d80.cpe.net.cable.rogers.com.53228 > 143.110.223.72.http: Flags [.], seq 2921:4381, ack 1, win 513, length 1460: HTTP
21:30:14.850266 IP 143.110.223.72.http > cpe9050ca275d83-cm9050ca275d80.cpe.net.cable.rogers.com.53228: Flags [.], ack 4381, win 495, length 0
21:30:14.850367 IP 143.110.223.72.http > cpe9050ca275d83-cm9050ca275d80.cpe.net.cable.rogers.com.53228: Flags [P.], seq 1:484, ack 4381, win 495, length 483: HTTP: HTTP/1.1 400 Bad Request
21:30:14.850401 IP 143.110.223.72.http > cpe9050ca275d83-cm9050ca275d80.cpe.net.cable.rogers.com.53228: Flags [F.], seq 484, ack 4381, win 495, length 0
21:30:14.850597 IP cpe9050ca275d83-cm9050ca275d80.cpe.net.cable.rogers.com.53228 > 143.110.223.72.http: Flags [.], seq 4381:5841, ack 1, win 513, length 1460: HTTP
21:30:14.850626 IP 143.110.223.72.http > cpe9050ca275d83-cm9050ca275d80.cpe.net.cable.rogers.com.53228: Flags [.], ack 5841, win 501, length 0
21:30:14.850765 IP cpe9050ca275d83-cm9050ca275d80.cpe.net.cable.rogers.com.53228 > 143.110.223.72.http: Flags [.], seq 5841:7301, ack 1, win 513, length 1460: HTTP
21:30:14.850789 IP 143.110.223.72.http > cpe9050ca275d83-cm9050ca275d80.cpe.net.cable.rogers.com.53228: Flags [.], ack 7301, win 501, length 0
21:30:14.851010 IP cpe9050ca275d83-cm9050ca275d80.cpe.net.cable.rogers.com.53228 > 143.110.223.72.http: Flags [.], seq 7301:8761, ack 1, win 513, length 1460: HTTP
21:30:14.851071 IP 143.110.223.72.http > cpe9050ca275d83-cm9050ca275d80.cpe.net.cable.rogers.com.53228: Flags [.], ack 8761, win 501, length 0
21:30:14.851535 IP cpe9050ca275d83-cm9050ca275d80.cpe.net.cable.rogers.com.53228 > 143.110.223.72.http: Flags [P.], seq 8761:10923, ack 1, win 513, length 2162: HTTP
21:30:14.851574 IP 143.110.223.72.http > cpe9050ca275d83-cm9050ca275d80.cpe.net.cable.rogers.com.53228: Flags [.], ack 10923, win 495, length 0
21:30:14.866714 IP cpe9050ca275d83-cm9050ca275d80.cpe.net.cable.rogers.com.53228 > 143.110.223.72.http: Flags [.], ack 485, win 511, length 0
21:30:14.871254 IP cpe9050ca275d83-cm9050ca275d80.cpe.net.cable.rogers.com.53228 > 143.110.223.72.http: Flags [F.], seq 10923, ack 485, win 511, length 0
21:30:14.871302 IP 143.110.223.72.http > cpe9050ca275d83-cm9050ca275d80.cpe.net.cable.rogers.com.53228: Flags [.], ack 10924, win 501, length 0
21:30:16.045965 IP cpe9050ca275d83-cm9050ca275d80.cpe.net.cable.rogers.com.53229 > 143.110.223.72.http: Flags [S], seq 248205564, win 64240, options [mss 1460,nop,wscale 8,nop,nop,sackOK], length 0
21:30:16.046091 IP 143.110.223.72.http > cpe9050ca275d83-cm9050ca275d80.cpe.net.cable.rogers.com.53229: Flags [S.], seq 209287085, ack 248205565, win 64240, options [mss 1460,nop,nop,sackOK,nop,wscale 7], length 0
21:30:16.064692 IP cpe9050ca275d83-cm9050ca275d80.cpe.net.cable.rogers.com.53229 > 143.110.223.72.http: Flags [.], ack 1, win 513, length 0
21:30:16.064947 IP cpe9050ca275d83-cm9050ca275d80.cpe.net.cable.rogers.com.53229 > 143.110.223.72.http: Flags [.], seq 1:1461, ack 1, win 513, length 1460: HTTP
21:30:16.065030 IP 143.110.223.72.http > cpe9050ca275d83-cm9050ca275d80.cpe.net.cable.rogers.com.53229: Flags [.], ack 1461, win 501, length 0
21:30:16.065166 IP cpe9050ca275d83-cm9050ca275d80.cpe.net.cable.rogers.com.53229 > 143.110.223.72.http: Flags [.], seq 1461:4381, ack 1, win 513, length 2920: HTTP
21:30:16.065195 IP 143.110.223.72.http > cpe9050ca275d83-cm9050ca275d80.cpe.net.cable.rogers.com.53229: Flags [.], ack 4381, win 485, length 0
21:30:16.065482 IP 143.110.223.72.http > cpe9050ca275d83-cm9050ca275d80.cpe.net.cable.rogers.com.53229: Flags [P.], seq 1:484, ack 4381, win 501, length 483: HTTP: HTTP/1.1 400 Bad Request
21:30:16.065524 IP 143.110.223.72.http > cpe9050ca275d83-cm9050ca275d80.cpe.net.cable.rogers.com.53229: Flags [F.], seq 484, ack 4381, win 501, length 0
21:30:16.065584 IP cpe9050ca275d83-cm9050ca275d80.cpe.net.cable.rogers.com.53229 > 143.110.223.72.http: Flags [.], seq 4381:5841, ack 1, win 513, length 1460: HTTP
21:30:16.065604 IP 143.110.223.72.http > cpe9050ca275d83-cm9050ca275d80.cpe.net.cable.rogers.com.53229: Flags [.], ack 5841, win 501, length 0
21:30:16.065715 IP cpe9050ca275d83-cm9050ca275d80.cpe.net.cable.rogers.com.53229 > 143.110.223.72.http: Flags [.], seq 5841:7301, ack 1, win 513, length 1460: HTTP
21:30:16.065747 IP 143.110.223.72.http > cpe9050ca275d83-cm9050ca275d80.cpe.net.cable.rogers.com.53229: Flags [.], ack 7301, win 501, length 0
21:30:16.066074 IP cpe9050ca275d83-cm9050ca275d80.cpe.net.cable.rogers.com.53229 > 143.110.223.72.http: Flags [.], seq 7301:8761, ack 1, win 513, length 1460: HTTP
21:30:16.066106 IP 143.110.223.72.http > cpe9050ca275d83-cm9050ca275d80.cpe.net.cable.rogers.com.53229: Flags [.], ack 8761, win 501, length 0
21:30:16.066185 IP cpe9050ca275d83-cm9050ca275d80.cpe.net.cable.rogers.com.53229 > 143.110.223.72.http: Flags [.], seq 8761:10221, ack 1, win 513, length 1460: HTTP
21:30:16.066232 IP 143.110.223.72.http > cpe9050ca275d83-cm9050ca275d80.cpe.net.cable.rogers.com.53229: Flags [.], ack 10221, win 494, length 0
21:30:16.066352 IP cpe9050ca275d83-cm9050ca275d80.cpe.net.cable.rogers.com.53229 > 143.110.223.72.http: Flags [P.], seq 10221:10923, ack 1, win 513, length 702: HTTP
21:30:16.066390 IP 143.110.223.72.http > cpe9050ca275d83-cm9050ca275d80.cpe.net.cable.rogers.com.53229: Flags [.], ack 10923, win 501, length 0
21:30:16.081913 IP cpe9050ca275d83-cm9050ca275d80.cpe.net.cable.rogers.com.53229 > 143.110.223.72.http: Flags [.], ack 485, win 511, length 0
21:30:16.087671 IP cpe9050ca275d83-cm9050ca275d80.cpe.net.cable.rogers.com.53229 > 143.110.223.72.http: Flags [F.], seq 10923, ack 485, win 511, length 0
21:30:16.087713 IP 143.110.223.72.http > cpe9050ca275d83-cm9050ca275d80.cpe.net.cable.rogers.com.53229: Flags [.], ack 10924, win 501, length 0
21:30:16.616362 IP cpe9050ca275d83-cm9050ca275d80.cpe.net.cable.rogers.com.53230 > 143.110.223.72.http: Flags [S], seq 2738495464, win 64240, options [mss 1460,nop,wscale 8,nop,nop,sackOK], length 0
21:30:16.616482 IP 143.110.223.72.http > cpe9050ca275d83-cm9050ca275d80.cpe.net.cable.rogers.com.53230: Flags [S.], seq 2326443520, ack 2738495465, win 64240, options [mss 1460,nop,nop,sackOK,nop,wscale 7], length 0
21:30:16.645180 IP cpe9050ca275d83-cm9050ca275d80.cpe.net.cable.rogers.com.53230 > 143.110.223.72.http: Flags [.], ack 1, win 513, length 0
21:30:16.651539 IP cpe9050ca275d83-cm9050ca275d80.cpe.net.cable.rogers.com.53230 > 143.110.223.72.http: Flags [.], seq 1:2921, ack 1, win 513, length 2920: HTTP
21:30:16.651653 IP 143.110.223.72.http > cpe9050ca275d83-cm9050ca275d80.cpe.net.cable.rogers.com.53230: Flags [.], ack 2921, win 495, length 0
21:30:16.651719 IP cpe9050ca275d83-cm9050ca275d80.cpe.net.cable.rogers.com.53230 > 143.110.223.72.http: Flags [.], seq 2921:4381, ack 1, win 513, length 1460: HTTP
21:30:16.651738 IP 143.110.223.72.http > cpe9050ca275d83-cm9050ca275d80.cpe.net.cable.rogers.com.53230: Flags [.], ack 4381, win 487, length 0
21:30:16.651849 IP cpe9050ca275d83-cm9050ca275d80.cpe.net.cable.rogers.com.53230 > 143.110.223.72.http: Flags [.], seq 4381:5841, ack 1, win 513, length 1460: HTTP
21:30:16.651875 IP 143.110.223.72.http > cpe9050ca275d83-cm9050ca275d80.cpe.net.cable.rogers.com.53230: Flags [.], ack 5841, win 479, length 0
21:30:16.652046 IP cpe9050ca275d83-cm9050ca275d80.cpe.net.cable.rogers.com.53230 > 143.110.223.72.http: Flags [.], seq 5841:7301, ack 1, win 513, length 1460: HTTP
21:30:16.652070 IP 143.110.223.72.http > cpe9050ca275d83-cm9050ca275d80.cpe.net.cable.rogers.com.53230: Flags [.], ack 7301, win 501, length 0
21:30:16.652242 IP 143.110.223.72.http > cpe9050ca275d83-cm9050ca275d80.cpe.net.cable.rogers.com.53230: Flags [P.], seq 1:484, ack 7301, win 501, length 483: HTTP: HTTP/1.1 400 Bad Request
21:30:16.652279 IP cpe9050ca275d83-cm9050ca275d80.cpe.net.cable.rogers.com.53230 > 143.110.223.72.http: Flags [.], seq 7301:8761, ack 1, win 513, length 1460: HTTP
21:30:16.652302 IP 143.110.223.72.http > cpe9050ca275d83-cm9050ca275d80.cpe.net.cable.rogers.com.53230: Flags [.], ack 8761, win 495, length 0
21:30:16.652336 IP 143.110.223.72.http > cpe9050ca275d83-cm9050ca275d80.cpe.net.cable.rogers.com.53230: Flags [F.], seq 484, ack 8761, win 495, length 0
21:30:16.652552 IP cpe9050ca275d83-cm9050ca275d80.cpe.net.cable.rogers.com.53230 > 143.110.223.72.http: Flags [P.], seq 8761:10923, ack 1, win 513, length 2162: HTTP
21:30:16.652589 IP 143.110.223.72.http > cpe9050ca275d83-cm9050ca275d80.cpe.net.cable.rogers.com.53230: Flags [.], ack 10923, win 495, length 0
21:30:16.669869 IP cpe9050ca275d83-cm9050ca275d80.cpe.net.cable.rogers.com.53230 > 143.110.223.72.http: Flags [.], ack 485, win 511, length 0
21:30:16.674586 IP cpe9050ca275d83-cm9050ca275d80.cpe.net.cable.rogers.com.53230 > 143.110.223.72.http: Flags [F.], seq 10923, ack 485, win 511, length 0
21:30:16.674630 IP 143.110.223.72.http > cpe9050ca275d83-cm9050ca275d80.cpe.net.cable.rogers.com.53230: Flags [.], ack 10924, win 501, length 0
21:30:17.032454 IP cpe9050ca275d83-cm9050ca275d80.cpe.net.cable.rogers.com.53231 > 143.110.223.72.http: Flags [S], seq 2629804034, win 64240, options [mss 1460,nop,wscale 8,nop,nop,sackOK], length 0
21:30:17.032565 IP 143.110.223.72.http > cpe9050ca275d83-cm9050ca275d80.cpe.net.cable.rogers.com.53231: Flags [S.], seq 1408215240, ack 2629804035, win 64240, options [mss 1460,nop,nop,sackOK,nop,wscale 7], length 0
21:30:17.051355 IP cpe9050ca275d83-cm9050ca275d80.cpe.net.cable.rogers.com.53231 > 143.110.223.72.http: Flags [.], ack 1, win 513, length 0
21:30:17.068162 IP cpe9050ca275d83-cm9050ca275d80.cpe.net.cable.rogers.com.53231 > 143.110.223.72.http: Flags [.], seq 1:1461, ack 1, win 513, length 1460: HTTP
21:30:17.068268 IP 143.110.223.72.http > cpe9050ca275d83-cm9050ca275d80.cpe.net.cable.rogers.com.53231: Flags [.], ack 1461, win 501, length 0
21:30:17.068579 IP 143.110.223.72.http > cpe9050ca275d83-cm9050ca275d80.cpe.net.cable.rogers.com.53231: Flags [P.], seq 1:484, ack 1461, win 501, length 483: HTTP: HTTP/1.1 400 Bad Request
21:30:17.068632 IP cpe9050ca275d83-cm9050ca275d80.cpe.net.cable.rogers.com.53231 > 143.110.223.72.http: Flags [.], seq 1461:2921, ack 1, win 513, length 1460: HTTP
21:30:17.068691 IP 143.110.223.72.http > cpe9050ca275d83-cm9050ca275d80.cpe.net.cable.rogers.com.53231: Flags [.], ack 2921, win 494, length 0
21:30:17.068740 IP 143.110.223.72.http > cpe9050ca275d83-cm9050ca275d80.cpe.net.cable.rogers.com.53231: Flags [F.], seq 484, ack 2921, win 501, length 0
