root@lamp-ubuntu-s-1vcpu-1gb-tor1-01:~# tcpdump -i eth0 tcp
tcpdump: verbose output suppressed, use -v or -vv for full protocol decode
listening on eth0, link-type EN10MB (Ethernet), capture size 262144 bytes
21:45:30.367581 IP 143.110.223.72.ssh > cpe9050ca275d83-cm9050ca275d80.cpe.net.cable.rogers.com.64819: Flags [P.], seq 940315919:940316027, ack 3305456775, win 501, length 108
21:45:30.367726 IP 143.110.223.72.ssh > cpe9050ca275d83-cm9050ca275d80.cpe.net.cable.rogers.com.64819: Flags [P.], seq 108:144, ack 1, win 501, length 36
21:45:30.367844 IP 143.110.223.72.ssh > cpe9050ca275d83-cm9050ca275d80.cpe.net.cable.rogers.com.64819: Flags [P.], seq 144:252, ack 1, win 501, length 108
21:45:30.367941 IP 143.110.223.72.ssh > cpe9050ca275d83-cm9050ca275d80.cpe.net.cable.rogers.com.64819: Flags [P.], seq 252:288, ack 1, win 501, length 36
21:45:30.380298 IP cpe9050ca275d83-cm9050ca275d80.cpe.net.cable.rogers.com.64819 > 143.110.223.72.ssh: Flags [.], ack 108, win 3088, length 0
21:45:30.386968 IP 143.110.223.72.ssh > cpe9050ca275d83-cm9050ca275d80.cpe.net.cable.rogers.com.64819: Flags [P.], seq 288:500, ack 1, win 501, length 212
21:45:30.387108 IP 143.110.223.72.ssh > cpe9050ca275d83-cm9050ca275d80.cpe.net.cable.rogers.com.64819: Flags [P.], seq 500:536, ack 1, win 501, length 36
21:45:30.387314 IP 143.110.223.72.ssh > cpe9050ca275d83-cm9050ca275d80.cpe.net.cable.rogers.com.64819: Flags [P.], seq 536:724, ack 1, win 501, length 188
21:45:30.387426 IP 143.110.223.72.ssh > cpe9050ca275d83-cm9050ca275d80.cpe.net.cable.rogers.com.64819: Flags [P.], seq 724:760, ack 1, win 501, length 36
21:45:30.387569 IP 143.110.223.72.ssh > cpe9050ca275d83-cm9050ca275d80.cpe.net.cable.rogers.com.64819: Flags [P.], seq 760:948, ack 1, win 501, length 188
21:45:30.387677 IP 143.110.223.72.ssh > cpe9050ca275d83-cm9050ca275d80.cpe.net.cable.rogers.com.64819: Flags [P.], seq 948:984, ack 1, win 501, length 36
21:45:30.387796 IP 143.110.223.72.ssh > cpe9050ca275d83-cm9050ca275d80.cpe.net.cable.rogers.com.64819: Flags [P.], seq 984:1172, ack 1, win 501, length 188
21:45:30.453978 IP 143.110.223.72.ssh > cpe9050ca275d83-cm9050ca275d80.cpe.net.cable.rogers.com.64819: Flags [.], seq 1172:2632, ack 1, win 501, length 1460
21:45:30.531614 IP cpe9050ca275d83-cm9050ca275d80.cpe.net.cable.rogers.com.64819 > 143.110.223.72.ssh: Flags [.], ack 1172, win 3091, length 0
21:45:30.531726 IP 143.110.223.72.ssh > cpe9050ca275d83-cm9050ca275d80.cpe.net.cable.rogers.com.64819: Flags [P.], seq 2632:3232, ack 1, win 501, length 600
21:45:30.531972 IP 143.110.223.72.ssh > cpe9050ca275d83-cm9050ca275d80.cpe.net.cable.rogers.com.64819: Flags [P.], seq 3232:3412, ack 1, win 501, length 180
21:45:30.532080 IP 143.110.223.72.ssh > cpe9050ca275d83-cm9050ca275d80.cpe.net.cable.rogers.com.64819: Flags [P.], seq 3412:3448, ack 1, win 501, length 36
21:45:30.532203 IP 143.110.223.72.ssh > cpe9050ca275d83-cm9050ca275d80.cpe.net.cable.rogers.com.64819: Flags [P.], seq 3448:3644, ack 1, win 501, length 196
21:45:30.532294 IP 143.110.223.72.ssh > cpe9050ca275d83-cm9050ca275d80.cpe.net.cable.rogers.com.64819: Flags [P.], seq 3644:3680, ack 1, win 501, length 36
21:45:30.532408 IP 143.110.223.72.ssh > cpe9050ca275d83-cm9050ca275d80.cpe.net.cable.rogers.com.64819: Flags [P.], seq 3680:3876, ack 1, win 501, length 196
21:45:30.532495 IP 143.110.223.72.ssh > cpe9050ca275d83-cm9050ca275d80.cpe.net.cable.rogers.com.64819: Flags [P.], seq 3876:3912, ack 1, win 501, length 36
21:45:30.532632 IP 143.110.223.72.ssh > cpe9050ca275d83-cm9050ca275d80.cpe.net.cable.rogers.com.64819: Flags [P.], seq 3912:4108, ack 1, win 501, length 196
21:45:30.532724 IP 143.110.223.72.ssh > cpe9050ca275d83-cm9050ca275d80.cpe.net.cable.rogers.com.64819: Flags [P.], seq 4108:4144, ack 1, win 501, length 36
21:45:30.532833 IP 143.110.223.72.ssh > cpe9050ca275d83-cm9050ca275d80.cpe.net.cable.rogers.com.64819: Flags [P.], seq 4144:4340, ack 1, win 501, length 196
21:45:30.532920 IP 143.110.223.72.ssh > cpe9050ca275d83-cm9050ca275d80.cpe.net.cable.rogers.com.64819: Flags [P.], seq 4340:4376, ack 1, win 501, length 36
21:45:30.533032 IP 143.110.223.72.ssh > cpe9050ca275d83-cm9050ca275d80.cpe.net.cable.rogers.com.64819: Flags [P.], seq 4376:4572, ack 1, win 501, length 196
21:45:30.533123 IP 143.110.223.72.ssh > cpe9050ca275d83-cm9050ca275d80.cpe.net.cable.rogers.com.64819: Flags [P.], seq 4572:4608, ack 1, win 501, length 36
21:45:30.533234 IP 143.110.223.72.ssh > cpe9050ca275d83-cm9050ca275d80.cpe.net.cable.rogers.com.64819: Flags [P.], seq 4608:4804, ack 1, win 501, length 196
21:45:30.533322 IP 143.110.223.72.ssh > cpe9050ca275d83-cm9050ca275d80.cpe.net.cable.rogers.com.64819: Flags [P.], seq 4804:4840, ack 1, win 501, length 36
21:45:30.533431 IP 143.110.223.72.ssh > cpe9050ca275d83-cm9050ca275d80.cpe.net.cable.rogers.com.64819: Flags [P.], seq 4840:5036, ack 1, win 501, length 196
21:45:30.533518 IP 143.110.223.72.ssh > cpe9050ca275d83-cm9050ca275d80.cpe.net.cable.rogers.com.64819: Flags [P.], seq 5036:5072, ack 1, win 501, length 36
21:45:30.533629 IP 143.110.223.72.ssh > cpe9050ca275d83-cm9050ca275d80.cpe.net.cable.rogers.com.64819: Flags [P.], seq 5072:5268, ack 1, win 501, length 196
21:45:30.533721 IP 143.110.223.72.ssh > cpe9050ca275d83-cm9050ca275d80.cpe.net.cable.rogers.com.64819: Flags [P.], seq 5268:5304, ack 1, win 501, length 36
21:45:30.543464 IP cpe9050ca275d83-cm9050ca275d80.cpe.net.cable.rogers.com.64819 > 143.110.223.72.ssh: Flags [.], ack 4340, win 3091, length 0
21:45:30.543531 IP 143.110.223.72.ssh > cpe9050ca275d83-cm9050ca275d80.cpe.net.cable.rogers.com.64819: Flags [P.], seq 5304:7856, ack 1, win 501, length 2552
21:45:30.543714 IP 143.110.223.72.ssh > cpe9050ca275d83-cm9050ca275d80.cpe.net.cable.rogers.com.64819: Flags [P.], seq 7856:8036, ack 1, win 501, length 180
21:45:30.543822 IP 143.110.223.72.ssh > cpe9050ca275d83-cm9050ca275d80.cpe.net.cable.rogers.com.64819: Flags [P.], seq 8036:8072, ack 1, win 501, length 36
21:45:30.543954 IP 143.110.223.72.ssh > cpe9050ca275d83-cm9050ca275d80.cpe.net.cable.rogers.com.64819: Flags [P.], seq 8072:8268, ack 1, win 501, length 196
21:45:30.544041 IP 143.110.223.72.ssh > cpe9050ca275d83-cm9050ca275d80.cpe.net.cable.rogers.com.64819: Flags [P.], seq 8268:8304, ack 1, win 501, length 36
21:45:30.544154 IP 143.110.223.72.ssh > cpe9050ca275d83-cm9050ca275d80.cpe.net.cable.rogers.com.64819: Flags [P.], seq 8304:8500, ack 1, win 501, length 196
21:45:30.544233 IP cpe9050ca275d83-cm9050ca275d80.cpe.net.cable.rogers.com.64819 > 143.110.223.72.ssh: Flags [.], ack 5036, win 3088, length 0
21:45:30.544257 IP cpe9050ca275d83-cm9050ca275d80.cpe.net.cable.rogers.com.64819 > 143.110.223.72.ssh: Flags [.], ack 5304, win 3087, length 0
21:45:30.544304 IP 143.110.223.72.ssh > cpe9050ca275d83-cm9050ca275d80.cpe.net.cable.rogers.com.64819: Flags [P.], seq 8500:8536, ack 1, win 501, length 36
21:45:30.544417 IP 143.110.223.72.ssh > cpe9050ca275d83-cm9050ca275d80.cpe.net.cable.rogers.com.64819: Flags [P.], seq 8536:8732, ack 1, win 501, length 196
21:45:30.544509 IP 143.110.223.72.ssh > cpe9050ca275d83-cm9050ca275d80.cpe.net.cable.rogers.com.64819: Flags [P.], seq 8732:8768, ack 1, win 501, length 36
21:45:30.544619 IP 143.110.223.72.ssh > cpe9050ca275d83-cm9050ca275d80.cpe.net.cable.rogers.com.64819: Flags [P.], seq 8768:8964, ack 1, win 501, length 196
21:45:30.544710 IP 143.110.223.72.ssh > cpe9050ca275d83-cm9050ca275d80.cpe.net.cable.rogers.com.64819: Flags [P.], seq 8964:9000, ack 1, win 501, length 36
21:45:30.544821 IP 143.110.223.72.ssh > cpe9050ca275d83-cm9050ca275d80.cpe.net.cable.rogers.com.64819: Flags [P.], seq 9000:9196, ack 1, win 501, length 196
21:45:30.544907 IP 143.110.223.72.ssh > cpe9050ca275d83-cm9050ca275d80.cpe.net.cable.rogers.com.64819: Flags [P.], seq 9196:9232, ack 1, win 501, length 36
21:45:30.545009 IP 143.110.223.72.ssh > cpe9050ca275d83-cm9050ca275d80.cpe.net.cable.rogers.com.64819: Flags [P.], seq 9232:9428, ack 1, win 501, length 196
21:45:30.545101 IP 143.110.223.72.ssh > cpe9050ca275d83-cm9050ca275d80.cpe.net.cable.rogers.com.64819: Flags [P.], seq 9428:9464, ack 1, win 501, length 36
21:45:30.545210 IP 143.110.223.72.ssh > cpe9050ca275d83-cm9050ca275d80.cpe.net.cable.rogers.com.64819: Flags [P.], seq 9464:9644, ack 1, win 501, length 180
21:45:30.545297 IP 143.110.223.72.ssh > cpe9050ca275d83-cm9050ca275d80.cpe.net.cable.rogers.com.64819: Flags [P.], seq 9644:9680, ack 1, win 501, length 36
21:45:30.545400 IP 143.110.223.72.ssh > cpe9050ca275d83-cm9050ca275d80.cpe.net.cable.rogers.com.64819: Flags [P.], seq 9680:9860, ack 1, win 501, length 180
21:45:30.545492 IP 143.110.223.72.ssh > cpe9050ca275d83-cm9050ca275d80.cpe.net.cable.rogers.com.64819: Flags [P.], seq 9860:9896, ack 1, win 501, length 36
21:45:30.545601 IP 143.110.223.72.ssh > cpe9050ca275d83-cm9050ca275d80.cpe.net.cable.rogers.com.64819: Flags [P.], seq 9896:10092, ack 1, win 501, length 196
21:45:30.545737 IP 143.110.223.72.ssh > cpe9050ca275d83-cm9050ca275d80.cpe.net.cable.rogers.com.64819: Flags [P.], seq 10092:10128, ack 1, win 501, length 36
21:45:30.545852 IP 143.110.223.72.ssh > cpe9050ca275d83-cm9050ca275d80.cpe.net.cable.rogers.com.64819: Flags [P.], seq 10128:10324, ack 1, win 501, length 196
21:45:30.545966 IP 143.110.223.72.ssh > cpe9050ca275d83-cm9050ca275d80.cpe.net.cable.rogers.com.64819: Flags [P.], seq 10324:10360, ack 1, win 501, length 36
21:45:30.546083 IP 143.110.223.72.ssh > cpe9050ca275d83-cm9050ca275d80.cpe.net.cable.rogers.com.64819: Flags [P.], seq 10360:10556, ack 1, win 501, length 196
21:45:30.546266 IP 143.110.223.72.ssh > cpe9050ca275d83-cm9050ca275d80.cpe.net.cable.rogers.com.64819: Flags [P.], seq 10556:11224, ack 1, win 501, length 668
21:45:30.546472 IP 143.110.223.72.ssh > cpe9050ca275d83-cm9050ca275d80.cpe.net.cable.rogers.com.64819: Flags [P.], seq 11224:12204, ack 1, win 501, length 980
21:45:30.546675 IP 143.110.223.72.ssh > cpe9050ca275d83-cm9050ca275d80.cpe.net.cable.rogers.com.64819: Flags [P.], seq 12204:13200, ack 1, win 501, length 996
21:45:30.546834 IP 143.110.223.72.ssh > cpe9050ca275d83-cm9050ca275d80.cpe.net.cable.rogers.com.64819: Flags [P.], seq 13200:13556, ack 1, win 501, length 356
21:45:30.546970 IP 143.110.223.72.ssh > cpe9050ca275d83-cm9050ca275d80.cpe.net.cable.rogers.com.64819: Flags [P.], seq 13556:13752, ack 1, win 501, length 196
21:45:30.547102 IP 143.110.223.72.ssh > cpe9050ca275d83-cm9050ca275d80.cpe.net.cable.rogers.com.64819: Flags [P.], seq 13752:13948, ack 1, win 501, length 196
21:45:30.547328 IP 143.110.223.72.ssh > cpe9050ca275d83-cm9050ca275d80.cpe.net.cable.rogers.com.64819: Flags [P.], seq 13948:14144, ack 1, win 501, length 196
21:45:30.547513 IP 143.110.223.72.ssh > cpe9050ca275d83-cm9050ca275d80.cpe.net.cable.rogers.com.64819: Flags [P.], seq 14144:14340, ack 1, win 501, length 196
21:45:30.547655 IP 143.110.223.72.ssh > cpe9050ca275d83-cm9050ca275d80.cpe.net.cable.rogers.com.64819: Flags [P.], seq 14340:14536, ack 1, win 501, length 196
21:45:30.547782 IP 143.110.223.72.ssh > cpe9050ca275d83-cm9050ca275d80.cpe.net.cable.rogers.com.64819: Flags [P.], seq 14536:14732, ack 1, win 501, length 196
21:45:30.547916 IP 143.110.223.72.ssh > cpe9050ca275d83-cm9050ca275d80.cpe.net.cable.rogers.com.64819: Flags [P.], seq 14732:14928, ack 1, win 501, length 196
21:45:30.548046 IP 143.110.223.72.ssh > cpe9050ca275d83-cm9050ca275d80.cpe.net.cable.rogers.com.64819: Flags [P.], seq 14928:15124, ack 1, win 501, length 196
21:45:30.548174 IP 143.110.223.72.ssh > cpe9050ca275d83-cm9050ca275d80.cpe.net.cable.rogers.com.64819: Flags [P.], seq 15124:15320, ack 1, win 501, length 196
21:45:30.548321 IP 143.110.223.72.ssh > cpe9050ca275d83-cm9050ca275d80.cpe.net.cable.rogers.com.64819: Flags [P.], seq 15320:15516, ack 1, win 501, length 196
21:45:30.548453 IP 143.110.223.72.ssh > cpe9050ca275d83-cm9050ca275d80.cpe.net.cable.rogers.com.64819: Flags [P.], seq 15516:15712, ack 1, win 501, length 196
21:45:30.557386 IP cpe9050ca275d83-cm9050ca275d80.cpe.net.cable.rogers.com.64819 > 143.110.223.72.ssh: Flags [.], ack 8768, win 3091, length 0
21:45:30.557442 IP 143.110.223.72.ssh > cpe9050ca275d83-cm9050ca275d80.cpe.net.cable.rogers.com.64819: Flags [P.], seq 15712:15908, ack 1, win 501, length 196
21:45:30.557692 IP 143.110.223.72.ssh > cpe9050ca275d83-cm9050ca275d80.cpe.net.cable.rogers.com.64819: Flags [P.], seq 15908:16248, ack 1, win 501, length 340
21:45:30.557849 IP 143.110.223.72.ssh > cpe9050ca275d83-cm9050ca275d80.cpe.net.cable.rogers.com.64819: Flags [P.], seq 16248:16444, ack 1, win 501, length 196
21:45:30.558004 IP 143.110.223.72.ssh > cpe9050ca275d83-cm9050ca275d80.cpe.net.cable.rogers.com.64819: Flags [P.], seq 16444:16640, ack 1, win 501, length 196
21:45:30.558140 IP 143.110.223.72.ssh > cpe9050ca275d83-cm9050ca275d80.cpe.net.cable.rogers.com.64819: Flags [P.], seq 16640:16836, ack 1, win 501, length 196
21:45:30.558277 IP 143.110.223.72.ssh > cpe9050ca275d83-cm9050ca275d80.cpe.net.cable.rogers.com.64819: Flags [P.], seq 16836:17032, ack 1, win 501, length 196
21:45:30.558414 IP 143.110.223.72.ssh > cpe9050ca275d83-cm9050ca275d80.cpe.net.cable.rogers.com.64819: Flags [P.], seq 17032:17228, ack 1, win 501, length 196
21:45:30.558550 IP 143.110.223.72.ssh > cpe9050ca275d83-cm9050ca275d80.cpe.net.cable.rogers.com.64819: Flags [P.], seq 17228:17424, ack 1, win 501, length 196
21:45:30.558687 IP 143.110.223.72.ssh > cpe9050ca275d83-cm9050ca275d80.cpe.net.cable.rogers.com.64819: Flags [P.], seq 17424:17620, ack 1, win 501, length 196
21:45:30.558815 IP 143.110.223.72.ssh > cpe9050ca275d83-cm9050ca275d80.cpe.net.cable.rogers.com.64819: Flags [P.], seq 17620:17816, ack 1, win 501, length 196
21:45:30.558949 IP 143.110.223.72.ssh > cpe9050ca275d83-cm9050ca275d80.cpe.net.cable.rogers.com.64819: Flags [P.], seq 17816:18012, ack 1, win 501, length 196
21:45:30.559086 IP 143.110.223.72.ssh > cpe9050ca275d83-cm9050ca275d80.cpe.net.cable.rogers.com.64819: Flags [P.], seq 18012:18208, ack 1, win 501, length 196
21:45:30.559280 IP 143.110.223.72.ssh > cpe9050ca275d83-cm9050ca275d80.cpe.net.cable.rogers.com.64819: Flags [P.], seq 18208:18404, ack 1, win 501, length 196
21:45:30.559441 IP 143.110.223.72.ssh > cpe9050ca275d83-cm9050ca275d80.cpe.net.cable.rogers.com.64819: Flags [P.], seq 18404:18600, ack 1, win 501, length 196
21:45:30.559575 IP 143.110.223.72.ssh > cpe9050ca275d83-cm9050ca275d80.cpe.net.cable.rogers.com.64819: Flags [P.], seq 18600:18796, ack 1, win 501, length 196
21:45:30.559704 IP 143.110.223.72.ssh > cpe9050ca275d83-cm9050ca275d80.cpe.net.cable.rogers.com.64819: Flags [P.], seq 18796:18992, ack 1, win 501, length 196
21:45:30.559840 IP 143.110.223.72.ssh > cpe9050ca275d83-cm9050ca275d80.cpe.net.cable.rogers.com.64819: Flags [P.], seq 18992:19188, ack 1, win 501, length 196
21:45:30.559966 IP 143.110.223.72.ssh > cpe9050ca275d83-cm9050ca275d80.cpe.net.cable.rogers.com.64819: Flags [P.], seq 19188:19384, ack 1, win 501, length 196
21:45:30.560099 IP 143.110.223.72.ssh > cpe9050ca275d83-cm9050ca275d80.cpe.net.cable.rogers.com.64819: Flags [P.], seq 19384:19580, ack 1, win 501, length 196
21:45:30.560223 IP 143.110.223.72.ssh > cpe9050ca275d83-cm9050ca275d80.cpe.net.cable.rogers.com.64819: Flags [P.], seq 19580:19776, ack 1, win 501, length 196
21:45:30.563411 IP cpe9050ca275d83-cm9050ca275d80.cpe.net.cable.rogers.com.64819 > 143.110.223.72.ssh: Flags [.], ack 9896, win 3086, length 0
21:45:30.563488 IP 143.110.223.72.ssh > cpe9050ca275d83-cm9050ca275d80.cpe.net.cable.rogers.com.64819: Flags [P.], seq 19776:19972, ack 1, win 501, length 196
21:45:30.563523 IP cpe9050ca275d83-cm9050ca275d80.cpe.net.cable.rogers.com.64819 > 143.110.223.72.ssh: Flags [.], ack 11224, win 3091, length 0
21:45:30.563752 IP 143.110.223.72.ssh > cpe9050ca275d83-cm9050ca275d80.cpe.net.cable.rogers.com.64819: Flags [P.], seq 19972:20456, ack 1, win 501, length 484
21:45:30.563909 IP 143.110.223.72.ssh > cpe9050ca275d83-cm9050ca275d80.cpe.net.cable.rogers.com.64819: Flags [P.], seq 20456:20652, ack 1, win 501, length 196
21:45:30.564055 IP 143.110.223.72.ssh > cpe9050ca275d83-cm9050ca275d80.cpe.net.cable.rogers.com.64819: Flags [P.], seq 20652:20848, ack 1, win 501, length 196
21:45:30.564193 IP 143.110.223.72.ssh > cpe9050ca275d83-cm9050ca275d80.cpe.net.cable.rogers.com.64819: Flags [P.], seq 20848:21044, ack 1, win 501, length 196
21:45:30.564324 IP 143.110.223.72.ssh > cpe9050ca275d83-cm9050ca275d80.cpe.net.cable.rogers.com.64819: Flags [P.], seq 21044:21240, ack 1, win 501, length 196
21:45:30.564362 IP cpe9050ca275d83-cm9050ca275d80.cpe.net.cable.rogers.com.64819 > 143.110.223.72.ssh: Flags [.], ack 15712, win 3091, length 0
21:45:30.564552 IP 143.110.223.72.ssh > cpe9050ca275d83-cm9050ca275d80.cpe.net.cable.rogers.com.64819: Flags [P.], seq 21240:21580, ack 1, win 501, length 340
21:45:30.564704 IP 143.110.223.72.ssh > cpe9050ca275d83-cm9050ca275d80.cpe.net.cable.rogers.com.64819: Flags [P.], seq 21580:21776, ack 1, win 501, length 196
21:45:30.564853 IP 143.110.223.72.ssh > cpe9050ca275d83-cm9050ca275d80.cpe.net.cable.rogers.com.64819: Flags [P.], seq 21776:21972, ack 1, win 501, length 196
21:45:30.564982 IP 143.110.223.72.ssh > cpe9050ca275d83-cm9050ca275d80.cpe.net.cable.rogers.com.64819: Flags [P.], seq 21972:22168, ack 1, win 501, length 196
21:45:30.565110 IP 143.110.223.72.ssh > cpe9050ca275d83-cm9050ca275d80.cpe.net.cable.rogers.com.64819: Flags [P.], seq 22168:22364, ack 1, win 501, length 196
21:45:30.565260 IP 143.110.223.72.ssh > cpe9050ca275d83-cm9050ca275d80.cpe.net.cable.rogers.com.64819: Flags [P.], seq 22364:22560, ack 1, win 501, length 196
21:45:30.565432 IP 143.110.223.72.ssh > cpe9050ca275d83-cm9050ca275d80.cpe.net.cable.rogers.com.64819: Flags [P.], seq 22560:22756, ack 1, win 501, length 196
21:45:30.565613 IP 143.110.223.72.ssh > cpe9050ca275d83-cm9050ca275d80.cpe.net.cable.rogers.com.64819: Flags [P.], seq 22756:22952, ack 1, win 501, length 196
21:45:30.565761 IP 143.110.223.72.ssh > cpe9050ca275d83-cm9050ca275d80.cpe.net.cable.rogers.com.64819: Flags [P.], seq 22952:23148, ack 1, win 501, length 196
21:45:30.565988 IP 143.110.223.72.ssh > cpe9050ca275d83-cm9050ca275d80.cpe.net.cable.rogers.com.64819: Flags [P.], seq 23148:23344, ack 1, win 501, length 196
21:45:30.566135 IP 143.110.223.72.ssh > cpe9050ca275d83-cm9050ca275d80.cpe.net.cable.rogers.com.64819: Flags [P.], seq 23344:23540, ack 1, win 501, length 196
21:45:30.566263 IP 143.110.223.72.ssh > cpe9050ca275d83-cm9050ca275d80.cpe.net.cable.rogers.com.64819: Flags [P.], seq 23540:23736, ack 1, win 501, length 196
21:45:30.566411 IP 143.110.223.72.ssh > cpe9050ca275d83-cm9050ca275d80.cpe.net.cable.rogers.com.64819: Flags [P.], seq 23736:23932, ack 1, win 501, length 196
21:45:30.566511 IP cpe9050ca275d83-cm9050ca275d80.cpe.net.cable.rogers.com.64819 > 143.110.223.72.ssh: Flags [.], ack 17816, win 3091, length 0
21:45:30.566543 IP cpe9050ca275d83-cm9050ca275d80.cpe.net.cable.rogers.com.64819 > 143.110.223.72.ssh: Flags [.], ack 18600, win 3088, length 0
21:45:30.566689 IP 143.110.223.72.ssh > cpe9050ca275d83-cm9050ca275d80.cpe.net.cable.rogers.com.64819: Flags [P.], seq 23932:24416, ack 1, win 501, length 484
21:45:30.566836 IP 143.110.223.72.ssh > cpe9050ca275d83-cm9050ca275d80.cpe.net.cable.rogers.com.64819: Flags [P.], seq 24416:24612, ack 1, win 501, length 196
21:45:30.566985 IP 143.110.223.72.ssh > cpe9050ca275d83-cm9050ca275d80.cpe.net.cable.rogers.com.64819: Flags [P.], seq 24612:24808, ack 1, win 501, length 196
21:45:30.567137 IP 143.110.223.72.ssh > cpe9050ca275d83-cm9050ca275d80.cpe.net.cable.rogers.com.64819: Flags [P.], seq 24808:25004, ack 1, win 501, length 196
21:45:30.567324 IP 143.110.223.72.ssh > cpe9050ca275d83-cm9050ca275d80.cpe.net.cable.rogers.com.64819: Flags [P.], seq 25004:25200, ack 1, win 501, length 196
21:45:30.567456 IP 143.110.223.72.ssh > cpe9050ca275d83-cm9050ca275d80.cpe.net.cable.rogers.com.64819: Flags [P.], seq 25200:25396, ack 1, win 501, length 196
21:45:30.567673 IP 143.110.223.72.ssh > cpe9050ca275d83-cm9050ca275d80.cpe.net.cable.rogers.com.64819: Flags [P.], seq 25396:25592, ack 1, win 501, length 196
21:45:30.567812 IP 143.110.223.72.ssh > cpe9050ca275d83-cm9050ca275d80.cpe.net.cable.rogers.com.64819: Flags [P.], seq 25592:25788, ack 1, win 501, length 196
21:45:30.567956 IP 143.110.223.72.ssh > cpe9050ca275d83-cm9050ca275d80.cpe.net.cable.rogers.com.64819: Flags [P.], seq 25788:25984, ack 1, win 501, length 196
21:45:30.568110 IP 143.110.223.72.ssh > cpe9050ca275d83-cm9050ca275d80.cpe.net.cable.rogers.com.64819: Flags [P.], seq 25984:26180, ack 1, win 501, length 196
21:45:30.568257 IP 143.110.223.72.ssh > cpe9050ca275d83-cm9050ca275d80.cpe.net.cable.rogers.com.64819: Flags [P.], seq 26180:26376, ack 1, win 501, length 196
21:45:30.568390 IP 143.110.223.72.ssh > cpe9050ca275d83-cm9050ca275d80.cpe.net.cable.rogers.com.64819: Flags [P.], seq 26376:26572, ack 1, win 501, length 196
21:45:30.568514 IP 143.110.223.72.ssh > cpe9050ca275d83-cm9050ca275d80.cpe.net.cable.rogers.com.64819: Flags [P.], seq 26572:26768, ack 1, win 501, length 196
21:45:30.568660 IP 143.110.223.72.ssh > cpe9050ca275d83-cm9050ca275d80.cpe.net.cable.rogers.com.64819: Flags [P.], seq 26768:26964, ack 1, win 501, length 196
21:45:30.568806 IP 143.110.223.72.ssh > cpe9050ca275d83-cm9050ca275d80.cpe.net.cable.rogers.com.64819: Flags [P.], seq 26964:27160, ack 1, win 501, length 196
21:45:30.568943 IP 143.110.223.72.ssh > cpe9050ca275d83-cm9050ca275d80.cpe.net.cable.rogers.com.64819: Flags [P.], seq 27160:27356, ack 1, win 501, length 196
21:45:30.569076 IP 143.110.223.72.ssh > cpe9050ca275d83-cm9050ca275d80.cpe.net.cable.rogers.com.64819: Flags [P.], seq 27356:27552, ack 1, win 501, length 196
21:45:30.569218 IP 143.110.223.72.ssh > cpe9050ca275d83-cm9050ca275d80.cpe.net.cable.rogers.com.64819: Flags [P.], seq 27552:27748, ack 1, win 501, length 196
21:45:30.569369 IP 143.110.223.72.ssh > cpe9050ca275d83-cm9050ca275d80.cpe.net.cable.rogers.com.64819: Flags [P.], seq 27748:27944, ack 1, win 501, length 196
21:45:30.569516 IP 143.110.223.72.ssh > cpe9050ca275d83-cm9050ca275d80.cpe.net.cable.rogers.com.64819: Flags [P.], seq 27944:28140, ack 1, win 501, length 196
21:45:30.569642 IP 143.110.223.72.ssh > cpe9050ca275d83-cm9050ca275d80.cpe.net.cable.rogers.com.64819: Flags [P.], seq 28140:28336, ack 1, win 501, length 196
21:45:30.569713 IP cpe9050ca275d83-cm9050ca275d80.cpe.net.cable.rogers.com.64819 > 143.110.223.72.ssh: Flags [.], ack 19776, win 3091, length 0
21:45:30.569903 IP 143.110.223.72.ssh > cpe9050ca275d83-cm9050ca275d80.cpe.net.cable.rogers.com.64819: Flags [P.], seq 28336:28676, ack 1, win 501, length 340
21:45:30.570052 IP 143.110.223.72.ssh > cpe9050ca275d83-cm9050ca275d80.cpe.net.cable.rogers.com.64819: Flags [P.], seq 28676:28872, ack 1, win 501, length 196
21:45:30.570203 IP 143.110.223.72.ssh > cpe9050ca275d83-cm9050ca275d80.cpe.net.cable.rogers.com.64819: Flags [P.], seq 28872:29068, ack 1, win 501, length 196
21:45:30.570336 IP 143.110.223.72.ssh > cpe9050ca275d83-cm9050ca275d80.cpe.net.cable.rogers.com.64819: Flags [P.], seq 29068:29264, ack 1, win 501, length 196
21:45:30.570460 IP 143.110.223.72.ssh > cpe9050ca275d83-cm9050ca275d80.cpe.net.cable.rogers.com.64819: Flags [P.], seq 29264:29460, ack 1, win 501, length 196
21:45:30.570616 IP 143.110.223.72.ssh > cpe9050ca275d83-cm9050ca275d80.cpe.net.cable.rogers.com.64819: Flags [P.], seq 29460:29656, ack 1, win 501, length 196
21:45:30.570763 IP 143.110.223.72.ssh > cpe9050ca275d83-cm9050ca275d80.cpe.net.cable.rogers.com.64819: Flags [P.], seq 29656:29852, ack 1, win 501, length 196
21:45:30.570899 IP 143.110.223.72.ssh > cpe9050ca275d83-cm9050ca275d80.cpe.net.cable.rogers.com.64819: Flags [P.], seq 29852:30048, ack 1, win 501, length 196
21:45:30.571040 IP 143.110.223.72.ssh > cpe9050ca275d83-cm9050ca275d80.cpe.net.cable.rogers.com.64819: Flags [P.], seq 30048:30244, ack 1, win 501, length 196
21:45:30.571199 IP 143.110.223.72.ssh > cpe9050ca275d83-cm9050ca275d80.cpe.net.cable.rogers.com.64819: Flags [P.], seq 30244:30440, ack 1, win 501, length 196
21:45:30.571341 IP 143.110.223.72.ssh > cpe9050ca275d83-cm9050ca275d80.cpe.net.cable.rogers.com.64819: Flags [P.], seq 30440:30636, ack 1, win 501, length 196
21:45:30.571485 IP 143.110.223.72.ssh > cpe9050ca275d83-cm9050ca275d80.cpe.net.cable.rogers.com.64819: Flags [P.], seq 30636:30832, ack 1, win 501, length 196
21:45:30.571637 IP 143.110.223.72.ssh > cpe9050ca275d83-cm9050ca275d80.cpe.net.cable.rogers.com.64819: Flags [P.], seq 30832:31028, ack 1, win 501, length 196
21:45:30.571776 IP 143.110.223.72.ssh > cpe9050ca275d83-cm9050ca275d80.cpe.net.cable.rogers.com.64819: Flags [P.], seq 31028:31224, ack 1, win 501, length 196
21:45:30.571927 IP 143.110.223.72.ssh > cpe9050ca275d83-cm9050ca275d80.cpe.net.cable.rogers.com.64819: Flags [P.], seq 31224:31420, ack 1, win 501, length 196
21:45:30.572069 IP 143.110.223.72.ssh > cpe9050ca275d83-cm9050ca275d80.cpe.net.cable.rogers.com.64819: Flags [P.], seq 31420:31616, ack 1, win 501, length 196
21:45:30.572215 IP 143.110.223.72.ssh > cpe9050ca275d83-cm9050ca275d80.cpe.net.cable.rogers.com.64819: Flags [P.], seq 31616:31812, ack 1, win 501, length 196
21:45:30.572368 IP 143.110.223.72.ssh > cpe9050ca275d83-cm9050ca275d80.cpe.net.cable.rogers.com.64819: Flags [P.], seq 31812:32008, ack 1, win 501, length 196
21:45:30.572515 IP 143.110.223.72.ssh > cpe9050ca275d83-cm9050ca275d80.cpe.net.cable.rogers.com.64819: Flags [P.], seq 32008:32204, ack 1, win 501, length 196
21:45:30.572650 IP 143.110.223.72.ssh > cpe9050ca275d83-cm9050ca275d80.cpe.net.cable.rogers.com.64819: Flags [P.], seq 32204:32400, ack 1, win 501, length 196
21:45:30.572779 IP 143.110.223.72.ssh > cpe9050ca275d83-cm9050ca275d80.cpe.net.cable.rogers.com.64819: Flags [P.], seq 32400:32596, ack 1, win 501, length 196
21:45:30.572938 IP 143.110.223.72.ssh > cpe9050ca275d83-cm9050ca275d80.cpe.net.cable.rogers.com.64819: Flags [P.], seq 32596:32792, ack 1, win 501, length 196
21:45:30.573075 IP 143.110.223.72.ssh > cpe9050ca275d83-cm9050ca275d80.cpe.net.cable.rogers.com.64819: Flags [P.], seq 32792:32988, ack 1, win 501, length 196
21:45:30.573200 IP 143.110.223.72.ssh > cpe9050ca275d83-cm9050ca275d80.cpe.net.cable.rogers.com.64819: Flags [P.], seq 32988:33184, ack 1, win 501, length 196
21:45:30.573324 IP 143.110.223.72.ssh > cpe9050ca275d83-cm9050ca275d80.cpe.net.cable.rogers.com.64819: Flags [P.], seq 33184:33380, ack 1, win 501, length 196
21:45:30.573458 IP 143.110.223.72.ssh > cpe9050ca275d83-cm9050ca275d80.cpe.net.cable.rogers.com.64819: Flags [P.], seq 33380:33576, ack 1, win 501, length 196
21:45:30.573599 IP 143.110.223.72.ssh > cpe9050ca275d83-cm9050ca275d80.cpe.net.cable.rogers.com.64819: Flags [P.], seq 33576:33772, ack 1, win 501, length 196
21:45:30.573746 IP 143.110.223.72.ssh > cpe9050ca275d83-cm9050ca275d80.cpe.net.cable.rogers.com.64819: Flags [P.], seq 33772:33968, ack 1, win 501, length 196
21:45:30.573914 IP 143.110.223.72.ssh > cpe9050ca275d83-cm9050ca275d80.cpe.net.cable.rogers.com.64819: Flags [P.], seq 33968:34164, ack 1, win 501, length 196
21:45:30.574040 IP 143.110.223.72.ssh > cpe9050ca275d83-cm9050ca275d80.cpe.net.cable.rogers.com.64819: Flags [P.], seq 34164:34360, ack 1, win 501, length 196
21:45:30.574165 IP 143.110.223.72.ssh > cpe9050ca275d83-cm9050ca275d80.cpe.net.cable.rogers.com.64819: Flags [P.], seq 34360:34556, ack 1, win 501, length 196
21:45:30.574298 IP 143.110.223.72.ssh > cpe9050ca275d83-cm9050ca275d80.cpe.net.cable.rogers.com.64819: Flags [P.], seq 34556:34752, ack 1, win 501, length 196
21:45:30.574438 IP 143.110.223.72.ssh > cpe9050ca275d83-cm9050ca275d80.cpe.net.cable.rogers.com.64819: Flags [P.], seq 34752:34948, ack 1, win 501, length 196
21:45:30.574563 IP 143.110.223.72.ssh > cpe9050ca275d83-cm9050ca275d80.cpe.net.cable.rogers.com.64819: Flags [P.], seq 34948:35144, ack 1, win 501, length 196
21:45:30.574708 IP 143.110.223.72.ssh > cpe9050ca275d83-cm9050ca275d80.cpe.net.cable.rogers.com.64819: Flags [P.], seq 35144:35340, ack 1, win 501, length 196
21:45:30.574852 IP 143.110.223.72.ssh > cpe9050ca275d83-cm9050ca275d80.cpe.net.cable.rogers.com.64819: Flags [P.], seq 35340:35536, ack 1, win 501, length 196
21:45:30.575002 IP 143.110.223.72.ssh > cpe9050ca275d83-cm9050ca275d80.cpe.net.cable.rogers.com.64819: Flags [P.], seq 35536:35732, ack 1, win 501, length 196
21:45:30.575133 IP 143.110.223.72.ssh > cpe9050ca275d83-cm9050ca275d80.cpe.net.cable.rogers.com.64819: Flags [P.], seq 35732:35928, ack 1, win 501, length 196
21:45:30.575313 IP 143.110.223.72.ssh > cpe9050ca275d83-cm9050ca275d80.cpe.net.cable.rogers.com.64819: Flags [P.], seq 35928:36124, ack 1, win 501, length 196
21:45:30.575592 IP 143.110.223.72.ssh > cpe9050ca275d83-cm9050ca275d80.cpe.net.cable.rogers.com.64819: Flags [P.], seq 36124:36320, ack 1, win 501, length 196
21:45:30.575741 IP 143.110.223.72.ssh > cpe9050ca275d83-cm9050ca275d80.cpe.net.cable.rogers.com.64819: Flags [P.], seq 36320:36516, ack 1, win 501, length 196
21:45:30.575879 IP 143.110.223.72.ssh > cpe9050ca275d83-cm9050ca275d80.cpe.net.cable.rogers.com.64819: Flags [P.], seq 36516:36712, ack 1, win 501, length 196
21:45:30.576028 IP 143.110.223.72.ssh > cpe9050ca275d83-cm9050ca275d80.cpe.net.cable.rogers.com.64819: Flags [P.], seq 36712:36908, ack 1, win 501, length 196
21:45:30.576181 IP 143.110.223.72.ssh > cpe9050ca275d83-cm9050ca275d80.cpe.net.cable.rogers.com.64819: Flags [P.], seq 36908:37104, ack 1, win 501, length 196
21:45:30.576314 IP 143.110.223.72.ssh > cpe9050ca275d83-cm9050ca275d80.cpe.net.cable.rogers.com.64819: Flags [P.], seq 37104:37300, ack 1, win 501, length 196
21:45:30.576569 IP 143.110.223.72.ssh > cpe9050ca275d83-cm9050ca275d80.cpe.net.cable.rogers.com.64819: Flags [P.], seq 37300:37496, ack 1, win 501, length 196
21:45:30.576733 IP 143.110.223.72.ssh > cpe9050ca275d83-cm9050ca275d80.cpe.net.cable.rogers.com.64819: Flags [P.], seq 37496:37692, ack 1, win 501, length 196
21:45:30.576882 IP 143.110.223.72.ssh > cpe9050ca275d83-cm9050ca275d80.cpe.net.cable.rogers.com.64819: Flags [P.], seq 37692:37888, ack 1, win 501, length 196
21:45:30.577033 IP 143.110.223.72.ssh > cpe9050ca275d83-cm9050ca275d80.cpe.net.cable.rogers.com.64819: Flags [P.], seq 37888:38084, ack 1, win 501, length 196
21:45:30.577156 IP cpe9050ca275d83-cm9050ca275d80.cpe.net.cable.rogers.com.64819 > 143.110.223.72.ssh: Flags [.], ack 22168, win 3091, length 0
21:45:30.577325 IP 143.110.223.72.ssh > cpe9050ca275d83-cm9050ca275d80.cpe.net.cable.rogers.com.64819: Flags [P.], seq 38084:38424, ack 1, win 501, length 340
21:45:30.577488 IP 143.110.223.72.ssh > cpe9050ca275d83-cm9050ca275d80.cpe.net.cable.rogers.com.64819: Flags [P.], seq 38424:38620, ack 1, win 501, length 196
21:45:30.577636 IP 143.110.223.72.ssh > cpe9050ca275d83-cm9050ca275d80.cpe.net.cable.rogers.com.64819: Flags [P.], seq 38620:38816, ack 1, win 501, length 196
21:45:30.577834 IP 143.110.223.72.ssh > cpe9050ca275d83-cm9050ca275d80.cpe.net.cable.rogers.com.64819: Flags [P.], seq 38816:39012, ack 1, win 501, length 196
21:45:30.578018 IP 143.110.223.72.ssh > cpe9050ca275d83-cm9050ca275d80.cpe.net.cable.rogers.com.64819: Flags [P.], seq 39012:39208, ack 1, win 501, length 196
21:45:30.578167 IP 143.110.223.72.ssh > cpe9050ca275d83-cm9050ca275d80.cpe.net.cable.rogers.com.64819: Flags [P.], seq 39208:39404, ack 1, win 501, length 196
21:45:30.578319 IP 143.110.223.72.ssh > cpe9050ca275d83-cm9050ca275d80.cpe.net.cable.rogers.com.64819: Flags [P.], seq 39404:39600, ack 1, win 501, length 196
21:45:30.578480 IP 143.110.223.72.ssh > cpe9050ca275d83-cm9050ca275d80.cpe.net.cable.rogers.com.64819: Flags [P.], seq 39600:39796, ack 1, win 501, length 196
21:45:30.578644 IP 143.110.223.72.ssh > cpe9050ca275d83-cm9050ca275d80.cpe.net.cable.rogers.com.64819: Flags [P.], seq 39796:39992, ack 1, win 501, length 196
21:45:30.578806 IP 143.110.223.72.ssh > cpe9050ca275d83-cm9050ca275d80.cpe.net.cable.rogers.com.64819: Flags [P.], seq 39992:40188, ack 1, win 501, length 196
21:45:30.578899 IP cpe9050ca275d83-cm9050ca275d80.cpe.net.cable.rogers.com.64819 > 143.110.223.72.ssh: Flags [.], ack 22952, win 3088, length 0
21:45:30.579037 IP 143.110.223.72.ssh > cpe9050ca275d83-cm9050ca275d80.cpe.net.cable.rogers.com.64819: Flags [P.], seq 40188:40528, ack 1, win 501, length 340
21:45:30.579220 IP 143.110.223.72.ssh > cpe9050ca275d83-cm9050ca275d80.cpe.net.cable.rogers.com.64819: Flags [P.], seq 40528:40724, ack 1, win 501, length 196
21:45:30.579373 IP 143.110.223.72.ssh > cpe9050ca275d83-cm9050ca275d80.cpe.net.cable.rogers.com.64819: Flags [P.], seq 40724:40920, ack 1, win 501, length 196
21:45:30.579522 IP 143.110.223.72.ssh > cpe9050ca275d83-cm9050ca275d80.cpe.net.cable.rogers.com.64819: Flags [P.], seq 40920:41116, ack 1, win 501, length 196
21:45:30.579669 IP 143.110.223.72.ssh > cpe9050ca275d83-cm9050ca275d80.cpe.net.cable.rogers.com.64819: Flags [P.], seq 41116:41312, ack 1, win 501, length 196
21:45:30.579820 IP 143.110.223.72.ssh > cpe9050ca275d83-cm9050ca275d80.cpe.net.cable.rogers.com.64819: Flags [P.], seq 41312:41508, ack 1, win 501, length 196
21:45:30.579862 IP cpe9050ca275d83-cm9050ca275d80.cpe.net.cable.rogers.com.64819 > 143.110.223.72.ssh: Flags [.], ack 25200, win 3091, length 0
21:45:30.580022 IP 143.110.223.72.ssh > cpe9050ca275d83-cm9050ca275d80.cpe.net.cable.rogers.com.64819: Flags [P.], seq 41508:41848, ack 1, win 501, length 340
21:45:30.580178 IP cpe9050ca275d83-cm9050ca275d80.cpe.net.cable.rogers.com.64819 > 143.110.223.72.ssh: Flags [.], ack 25788, win 3088, length 0
21:45:30.580212 IP cpe9050ca275d83-cm9050ca275d80.cpe.net.cable.rogers.com.64819 > 143.110.223.72.ssh: Flags [.], ack 27748, win 3091, length 0
21:45:30.580411 IP 143.110.223.72.ssh > cpe9050ca275d83-cm9050ca275d80.cpe.net.cable.rogers.com.64819: Flags [P.], seq 41848:42044, ack 1, win 501, length 196
21:45:30.580507 IP 143.110.223.72.ssh > cpe9050ca275d83-cm9050ca275d80.cpe.net.cable.rogers.com.64819: Flags [P.], seq 42044:42368, ack 1, win 501, length 324
21:45:30.580657 IP 143.110.223.72.ssh > cpe9050ca275d83-cm9050ca275d80.cpe.net.cable.rogers.com.64819: Flags [P.], seq 42368:42724, ack 1, win 501, length 356
21:45:30.580784 IP 143.110.223.72.ssh > cpe9050ca275d83-cm9050ca275d80.cpe.net.cable.rogers.com.64819: Flags [P.], seq 42724:42920, ack 1, win 501, length 196
21:45:30.580910 IP 143.110.223.72.ssh > cpe9050ca275d83-cm9050ca275d80.cpe.net.cable.rogers.com.64819: Flags [P.], seq 42920:43116, ack 1, win 501, length 196
21:45:30.581087 IP 143.110.223.72.ssh > cpe9050ca275d83-cm9050ca275d80.cpe.net.cable.rogers.com.64819: Flags [P.], seq 43116:43312, ack 1, win 501, length 196
21:45:30.581244 IP 143.110.223.72.ssh > cpe9050ca275d83-cm9050ca275d80.cpe.net.cable.rogers.com.64819: Flags [P.], seq 43312:43508, ack 1, win 501, length 196
21:45:30.581437 IP 143.110.223.72.ssh > cpe9050ca275d83-cm9050ca275d80.cpe.net.cable.rogers.com.64819: Flags [P.], seq 43508:43704, ack 1, win 501, length 196
21:45:30.581608 IP 143.110.223.72.ssh > cpe9050ca275d83-cm9050ca275d80.cpe.net.cable.rogers.com.64819: Flags [P.], seq 43704:43900, ack 1, win 501, length 196
21:45:30.581778 IP 143.110.223.72.ssh > cpe9050ca275d83-cm9050ca275d80.cpe.net.cable.rogers.com.64819: Flags [P.], seq 43900:44096, ack 1, win 501, length 196
21:45:30.581930 IP 143.110.223.72.ssh > cpe9050ca275d83-cm9050ca275d80.cpe.net.cable.rogers.com.64819: Flags [P.], seq 44096:44292, ack 1, win 501, length 196
21:45:30.582058 IP 143.110.223.72.ssh > cpe9050ca275d83-cm9050ca275d80.cpe.net.cable.rogers.com.64819: Flags [P.], seq 44292:44488, ack 1, win 501, length 196
21:45:30.582180 IP 143.110.223.72.ssh > cpe9050ca275d83-cm9050ca275d80.cpe.net.cable.rogers.com.64819: Flags [P.], seq 44488:44684, ack 1, win 501, length 196
21:45:30.582252 IP cpe9050ca275d83-cm9050ca275d80.cpe.net.cable.rogers.com.64819 > 143.110.223.72.ssh: Flags [.], ack 29068, win 3085, length 0
21:45:30.582443 IP 143.110.223.72.ssh > cpe9050ca275d83-cm9050ca275d80.cpe.net.cable.rogers.com.64819: Flags [P.], seq 44684:45024, ack 1, win 501, length 340
21:45:30.582593 IP 143.110.223.72.ssh > cpe9050ca275d83-cm9050ca275d80.cpe.net.cable.rogers.com.64819: Flags [P.], seq 45024:45220, ack 1, win 501, length 196
21:45:30.582722 IP 143.110.223.72.ssh > cpe9050ca275d83-cm9050ca275d80.cpe.net.cable.rogers.com.64819: Flags [P.], seq 45220:45416, ack 1, win 501, length 196
21:45:30.582845 IP 143.110.223.72.ssh > cpe9050ca275d83-cm9050ca275d80.cpe.net.cable.rogers.com.64819: Flags [P.], seq 45416:45612, ack 1, win 501, length 196
21:45:30.582974 IP 143.110.223.72.ssh > cpe9050ca275d83-cm9050ca275d80.cpe.net.cable.rogers.com.64819: Flags [P.], seq 45612:45808, ack 1, win 501, length 196
21:45:30.583099 IP 143.110.223.72.ssh > cpe9050ca275d83-cm9050ca275d80.cpe.net.cable.rogers.com.64819: Flags [P.], seq 45808:46004, ack 1, win 501, length 196
21:45:30.583264 IP 143.110.223.72.ssh > cpe9050ca275d83-cm9050ca275d80.cpe.net.cable.rogers.com.64819: Flags [P.], seq 46004:46200, ack 1, win 501, length 196
21:45:30.583413 IP cpe9050ca275d83-cm9050ca275d80.cpe.net.cable.rogers.com.64819 > 143.110.223.72.ssh: Flags [.], ack 31028, win 3091, length 0
21:45:30.583436 IP cpe9050ca275d83-cm9050ca275d80.cpe.net.cable.rogers.com.64819 > 143.110.223.72.ssh: Flags [.], ack 32008, win 3087, length 0
21:45:30.583449 IP 143.110.223.72.ssh > cpe9050ca275d83-cm9050ca275d80.cpe.net.cable.rogers.com.64819: Flags [P.], seq 46200:46396, ack 1, win 501, length 196
21:45:30.583563 IP cpe9050ca275d83-cm9050ca275d80.cpe.net.cable.rogers.com.64819 > 143.110.223.72.ssh: Flags [.], ack 33968, win 3091, length 0
21:45:30.583699 IP 143.110.223.72.ssh > cpe9050ca275d83-cm9050ca275d80.cpe.net.cable.rogers.com.64819: Flags [P.], seq 46396:47032, ack 1, win 501, length 636
21:45:30.583834 IP 143.110.223.72.ssh > cpe9050ca275d83-cm9050ca275d80.cpe.net.cable.rogers.com.64819: Flags [P.], seq 47032:47228, ack 1, win 501, length 196
21:45:30.583960 IP 143.110.223.72.ssh > cpe9050ca275d83-cm9050ca275d80.cpe.net.cable.rogers.com.64819: Flags [P.], seq 47228:47424, ack 1, win 501, length 196
21:45:30.584087 IP 143.110.223.72.ssh > cpe9050ca275d83-cm9050ca275d80.cpe.net.cable.rogers.com.64819: Flags [P.], seq 47424:47620, ack 1, win 501, length 196
21:45:30.584219 IP 143.110.223.72.ssh > cpe9050ca275d83-cm9050ca275d80.cpe.net.cable.rogers.com.64819: Flags [P.], seq 47620:47816, ack 1, win 501, length 196
21:45:30.584342 IP 143.110.223.72.ssh > cpe9050ca275d83-cm9050ca275d80.cpe.net.cable.rogers.com.64819: Flags [P.], seq 47816:48012, ack 1, win 501, length 196
21:45:30.584466 IP 143.110.223.72.ssh > cpe9050ca275d83-cm9050ca275d80.cpe.net.cable.rogers.com.64819: Flags [P.], seq 48012:48208, ack 1, win 501, length 196
21:45:30.584597 IP 143.110.223.72.ssh > cpe9050ca275d83-cm9050ca275d80.cpe.net.cable.rogers.com.64819: Flags [P.], seq 48208:48404, ack 1, win 501, length 196
21:45:30.584722 IP 143.110.223.72.ssh > cpe9050ca275d83-cm9050ca275d80.cpe.net.cable.rogers.com.64819: Flags [P.], seq 48404:48600, ack 1, win 501, length 196
21:45:30.584858 IP 143.110.223.72.ssh > cpe9050ca275d83-cm9050ca275d80.cpe.net.cable.rogers.com.64819: Flags [P.], seq 48600:48796, ack 1, win 501, length 196
21:45:30.584989 IP 143.110.223.72.ssh > cpe9050ca275d83-cm9050ca275d80.cpe.net.cable.rogers.com.64819: Flags [P.], seq 48796:48992, ack 1, win 501, length 196
21:45:30.585111 IP 143.110.223.72.ssh > cpe9050ca275d83-cm9050ca275d80.cpe.net.cable.rogers.com.64819: Flags [P.], seq 48992:49188, ack 1, win 501, length 196
21:45:30.585236 IP 143.110.223.72.ssh > cpe9050ca275d83-cm9050ca275d80.cpe.net.cable.rogers.com.64819: Flags [P.], seq 49188:49384, ack 1, win 501, length 196
21:45:30.585367 IP 143.110.223.72.ssh > cpe9050ca275d83-cm9050ca275d80.cpe.net.cable.rogers.com.64819: Flags [P.], seq 49384:49580, ack 1, win 501, length 196
21:45:30.585492 IP 143.110.223.72.ssh > cpe9050ca275d83-cm9050ca275d80.cpe.net.cable.rogers.com.64819: Flags [P.], seq 49580:49776, ack 1, win 501, length 196
